,answers,average_noun_counts,average_verb_counts
0, WHO 홈페이지 안내 확인 해외 여러 매체의 기사 확인검증 내용 세계보건기구WHO블룸버그 통신세계이동통신사업자연합회GSMA가 허위 정보라고 밝힘상황이 심상치 않자 세계보건기구WHO까지 나섰다WHO는 최근 홈페이지 코로나 항목의 미신깨기Mythbusters 코너에 실은 글을 통해 G 모바일 네트워크는 코로나를 전파하지 않는다고 밝혔다WHO 코로나  미신 깨기WHO는 또 바이러스는 무선 전파 모바일 네트워크를 타고 이동할 수 없다며 코로나는 G 네트워크를 사용하지 않는 많은 나라들에서 확산하고 있다고 지적했다WHO는 코로나는 감염자가 기침 재채기할 때나 말을 할 때 비말을 통해 전파된다며 또 오염된 표면을 만진 뒤 눈이나 입 코를 만짐으로써 감염되기도 한다고 강조했다  WHO홈페이지 확인_클릭그 뿐 아니라 영국의 스테판 파위스 보건국장은 최근 G 이야기는 전적으로 완전히 쓰레기 같은 것이며 난센스라며 그것은 최악의 가짜뉴스라고 말했다고 로이터 통신이 지난 일 보도했다파위스 국장은 그 네트워크G는 우리의 긴급한 서비스에 사용되고 보건 근로자들이 이용한다며 나는 이 보건 위기에 우리가 대응하는데 필요한 바로 그 인프라에 대항해 행동하려는 사람들에게 분노하며 역겨움을 느낀다고 밝혔다또 블룸버그 통신의 취재에 응한 사이먼 클라크 영국 레딩대 부교수세포 미생물학 전공는 코로나가 G 이동전화 신호에 의해 발병된다는 생각은 완전한 쓰레기라고 일갈한 뒤 G 무선 신호는 전자기파이며 휴대전화 서비스에 이미 사용된 것과 매우 유사하다며 전자기파와 바이러스는 별개라고 말했다아울러 세계이동통신사업자연합회GSMA는 지난 일 홈페이지에 올린 성명을 통해 영국서 발생한 기지국 방화 사건을 규탄하면서 이 허위정보 운동은 중요한 인프라와 공공 서비스 경제를 지키는 핵심 근로자들을 겨냥한 파괴 행위를 유발하고 있다고 지적했다 성명 살펴보기_클릭 한 서방 매체에는 일국 정부가 개입된 조직적 거짓 정보 유포 가능성도 거론됨블룸버그 통신은 지난 일 자 기사에서 G 기술과 코로나의 창궐을 연결하는 음모론이 급속도로 동력을 얻고 있다며 그 음모론은 또한 몇몇 연구자들이 말하는 조직화한 허위정보 캠페인에 의해 점점 강화하고 있다고 썼다통신에 따르면 카타르 소재 하마드 빈 칼리파 대학 연구자인 마크 오웬 존스 씨는 최근 G와 코로나를 언급한 약 만천건의 트윗을 분석한 결과 불순한 활동을 하는 것으로 보이는 계정들이 다수 발견됐다고 밝혔다온라인 허위정보 네트워크 전문가인 존스 씨는 문제의 트윗들이 일부 국가가 지원하는 공작의 전형적인 양태를 가지고 있다며 년 미국 대통령 선거때 허위정보 공작의 배후로 지목됐던 러시아 인터넷 조사기관이 쓴 수법과 유사한 수법을 썼다고 지적했다다만 그는 러시아나 다른 정부 또는 단체가 이번 가짜뉴스 유포의 배후에 있다는 결론을 내지는 못했다고 밝혔다이와 함께 블룸버그 통신은 G와 연계된 보건 리스크를 거론하는 음모론은 짧게 잡아도 년부터 유포됐다고 소개했다먼저 인터넷 포럼과 유튜브 그 다음엔 미국의 극우 성향 음모론 사이트 인포워스InfoWars와 러시아 국영방송 RT가 이 같은 음모론을 다뤘다 RT는 지난 년 G가 사람과 야생동물에 암을 유발할 수 있다며 주의할 것을 촉구하는 보도를 했다해당 팩트는 전혀 사실 아님으로 검증됐다,20.333333333333332,4.4
1,검증방식환자의 눈을 보기만 해도 신종 코로나바이러스에 감염된다는 주장이 어떻게 퍼졌는지 경로를 확인했다 가장 처음 문제가 제기된 중국 의사의 SNS 원문을 확인했다  의학적 근거가 있는지 전문가들에게 물었다보호 안경을 착용하지 않은 채 신종 코로나바이러스 환자를 진료했다가 감염됐다는 중국 의사의 SNS 게시글은 인터넷에 빠르게 퍼졌다 이후 인터넷에서는 환자의 눈만 봐도 감염된다 각막을 통해 감염될 수 있다는 소문까지 돌기 시작했다중국 의사가 올린 SNS 게시물 원문을 확인했다 마스크를 쓰고 보호 안경을 쓰지 않고 환자를 진료했는데 일 뒤 자신도 감염됐다는 추측을 담은 글이었다 구체적으로 눈을 통해 어떻게 바이러스가 들어갔는지에 대한 설명은 없었다전문가들은 눈을 바라만 봐도 감염된다는 건 불가능한 일이라고 입을 모았다 물론 감염자가 기침 재채기를 해서 침방울 안에 있는 바이러스가 근거리에 있는 사람의 눈에 튀었을 때 눈 안쪽 점막을 통해 바이러스가 침투할 수 있다 신종 코로나바이러스에 노출된 손으로 눈을 비빌 때 역시 감염 확률이 높아진다 하지만 코로나 바이러스 같은 호흡기계 바이러스는 비말 감염으로만 역학적으로 증명됐을 뿐 공기 감염으로는 증명된 사례가 없었다 김우주  고려대 구로병원 감염내과 교수  영화에 나올 만한 소설 같은 얘기고요 환자가 기침 재채기를 하고 작은 침방울이 상대방의 눈이나 코나 점막에 달라붙었을 때 감염되는 것입니다백순영  가톨릭 의대 교수  코로나 바이러스와 같은 호흡기계 바이러스들은 비말 감염으로만 알려져 있고 공기 감염으로는 전염되지 않는 것이 역학적으로 증명됐다감염자가 기침이나 재채기를 할 때 침방울이 눈에 튀면 전염될 수 있다 바이러스가 묻은 손으로 눈을 비벼도 전염될 수 있다 하지만 신종 코로나바이러스 환자와 눈만 마주쳐도 감염된다는 건 현재로선 근거 없는 주장이다 하지만 아직 충분한 임상 실험 결과가 쌓이지 않았기 때문에 해당 주장은 대체로 사실이 아니다Powered by Froala Editor,10.352941176470589,3.0588235294117645
2, 코로나 때문에 싱가포르에서 그랩 서비스 중단월 일 오전 헤럴드경제가 中폭스바겐 공장가동 연기 싱가포르 그랩은 서비스 중단이라는 제목의 보도를 내놨다  헤럴드경제는 이 기사에서 동남아시아의 우버라고 불리는 차량공유서비스 그랩은 싱가포르에서 당분간 서비스를 중단키로 했다 신종코로나 확진자가 명에 달해 우려가 고조된 영향이다라고 전했다 사실일까 검증 사실 블룸버그 보도 원문은 그랩쉐어 카풀링 중단 그랩 서비스 중 일부싱가포르의 공유차량 서비스인 그랩GRAB은 우버UBER와의 경쟁에서 이기고 우버가 동남아에서 사업을 접게 만든 회사다 년 그랩은 우버의 동남아시아 사업 부문을 인수했고 우버는 합병회사의 지분 를 받았다 이후 그랩은 동남아 지역 차량공유와 음식배달 사업의 최강자가 되었다 같은 해 현대차그룹은 그랩에 억만 달러를 투자하겠다는 계획을 밝히기도 했다 이처럼 그랩은 동남아에서는 가장 주목받는 회사 중 하나로 뽑힌다그런 그랩의 본사가 있는 싱가포르에서 서비스를 중단한다면 기업 가치와 지역 경제에 미치는 영향이 상당할 것이다 더불어 신종 코로나바이러스로 인해 공유 경제가 타격을 받는다면 이목이 집중될 수밖에 없다기자는 직접 헤럴드경제가 인용했다는 블룸버그 기사 원문을 확인했다 그 결과 헤럴드경제의 기사는 원문과 다소 차이가 있었다 우선 헤럴드경제가 인용했다는 블룸버그의 기사 Grab Suspends Singapore Carpooling의 내용은 아래와 같다Grab Holdings Inc which runs Singapores biggest ridehailing app said it will temporarily suspend its GrabShare carpooling services starting Sunday as the number of coronavirus cases in the city reached  싱가포르 최대의 공유차량앱을 운영하고 있는 그랩 홀딩스는 신종 코로나바이러스 감염자가 명에 달함에 따라 일요일부터 그랩쉐어 카풀링 서비스를 잠정 중단한다고 말했다싱가포르에서 확진자가 명을 넘어서면서 GrabShare carpooling services 즉 그랩쉐어 카풀링 서비스를 잠정적으로 중단한다는 내용이다 그랩 서비스 전체가 중단된다는 얘기가 아니라는 이야기다 블룸버그를 인용한 헤럴드경제 기자가 그랩쉐어 서비스에 대한 정확한 이해 없이 그랩이 싱가포르에서 전체 서비스를 중단한 것처럼 기사를 쓴 것으로 보인다 정리하자면 그랩이 월 일 새벽 시를 기준으로 싱가포르에서 그랩쉐어GrabShare 서비스를 중단한 것은 맞다 하지만 이는 다른 승객과 차량을 함께 이용하는 합승 형식의 서비스다 그랩이 싱가포르에서 제공하는 차량 공유 서비스 항목 여덟 가지 가운데 하나일 뿐이다주력 서비스인 저스트그랩JustGrab 등 대부분의 서비스는 그대로 제공된다 이용자 입장에서는 큰 변화가 없고 그랩 입장에서도 요금이 상대적으로 저렴한 서비스 하나만 중단한 것이다 나머지 서비스를 통해 해당 수요를 대체할 수 있으니 그랩의 사업 전체에 미칠 영향은 미미할 것으로 보인다헤럴드경제의 보도는 그랩 서비스 전체의 중단으로 읽힐 수 있다 부정확한 내용의 기사로 인해 사태가 실제보다 더 심각하게 느껴지도록 만드는 건 적절하지 않다  전혀 사실 아님헤럴드경제가 인용한 블룸버그 기사의 원문을 확인한 결과 모든 서비스의 중단이 아니라 그랩쉐어 카풀링 서비스를 잠정 중단하는 것이다 또한 그랩 홈페이지 등을 직접 확인한 결과 그랩쉐어 카풀링 서비스를 제외한 나머지 서비스는 그대로 이용 가능한 상태다 동남아시아의 우버라고 불리는 차량공유서비스 그랩은 싱가포르에서 당분간 서비스를 중단키로 했다라는 헤럴드경제의 보도는 전혀 사실이 아니다,14.0,3.380952380952381
3, 자치단체나 병원이 코로나  무증상 감염자나 잠복기 환자를 상대로 검사를 강제할 수 있을까     검증내용 감염병예방법이 올 월 개정되기 전 감염병 의사환자 즉 의심자에 대해선 검사를 강제할 수 있는 조항이 없었다 JTV 년 월 일 뉴스 자료 화면 감염병 환자만 처벌할 수 있는 조항이 있었다 관련법에 따르면 감염병 환자는 입원과 진료를 거부하면 징역 또는 만원 이하의 벌금이 부과된다감염병예방법 제 조 감염병에 관해 필요한 사실을 거짓으로 진술하거나 거짓 자료를 제출하면 안된다는 조항도 존재한다 이 조항을 어겨도 만원 이하의 벌금이 부과된다 그러나 법안이 개정된 후 감염병 환자 뿐만 아니라 감염병 의심자도 검사를 거부하면 처벌을 받을 수 있게 됐다 다만 쟁점은 남아있다 감염병 의심환자를 상대로 강제조사를 실시하기 위해서는 근거가 명확해야 한다 강영석 전라북도 보건의료과장은 이번에 법이 개정되서 감염병 의심환자를 강제로 검사할 수 있는 방안이 생겼다며 그러나 무분별하게 의심자를 상정해놓고 조사를 하진 못하고 정확한 의학적 판단이 있어야 한다고 말했다  국회에서 올 월 감염병예방법 제조가 개정된  후 자치단체와 의료기관이 코로나 감염병 의심자를 강제로 조사할 수 있는 권한이 생겼다 다만 전문가가 의학적으로 정확하게 판단을 내려야 한다는 전제가 깔려있다한편 B씨는 논란이 일자 보건당국의 검사에 응했으며 음성 판정을 받았다,20.428571428571427,4.714285714285714
4,일 오전 시까지 확인된 코로나 감염환자 명의 감염 원인을 파악하기 위해 질병관리본부가 실시간으로 공개한 코로나 감염 통계자료를 전수조사함감염원인이 확인된 번 환자까지 확인한 결과 감염원인별 환자 수는 중국에서 감염된 한국인 명과 중국인 명 싱가포르에서 감염된 한국인 명 태국에서 감염된 한국인 명 일본에서 감염된 중국인 명 한국인에게 감염된 한국인 명과 중국인 명이었음국내에 입국한 중국 여행자에 의해 감염된 사례는 단 한건도 없었음다만 신천지 대구교회 및 청도 대남병원 관련 감염환자 명의 감염원인이 아직 명확하게 밝혀지지 않아 추후 역학 조사를 통해 중국인 입국자가 감염원인인 사례가 발생할 가능성을 완전히 배제할 수 없는 상황임결국 중국인 여행자가 국내에 감염시킨 사례보다 중국에서 들어온 우리 국민이 감염시킨 사례가 더 많았다는 박능후 보건복지부 장관의 발언은 감염원인이 밝혀진 번 환자까지는 상당한 근거가 있는 것으로 평가되지만 감염환자가 폭증한 번 환자 이후 상황에서는 타당성이 결여됨,119.0,14.0
5,대만 전문가들이 제시한 코로나 자가진단법이라며 메신저나 온라인게시판에 떠도는 글입니다 네이버 카페 캡쳐검증내용초 숨참기 진단으로 코로나 감염 여부 진단 가능사실아님먼저 이 글이 주장하는 진단법의 구조를 뜯어보겠습니다 초 이상 숨참기  기침 불편함 답답함 없이 가능 폐섬유화증이 없다는 뜻  코로나 감염되지 않았다는 것이 자가진단법이 맞으려면 폐섬유화증이 있으면 코로나 감염이다부터 성립해야 합니다다시 말해 코로나 감염환자가 겪는 초기 증상 또는 전조 증상에 폐섬유화증이 있어야 합니다하지만 그렇지 않습니다현재까지 나온 의학적 판단을 종합하면 폐섬유화증은 보통 중증 폐렴 환자가 치료받은 후 일부가 겪는 후유증입니다그런데 코로나 환자가 모두 폐렴 증세가 있는 것도 아닐뿐더러 폐렴 증세가 있다 하더라도 폐섬유화증은 아예 없거나있더라도 증상 초기가 아니라 주로 치료 후에 나타납니다즉 폐섬유화 증상 유무를 확인하는 것으로 코로나 감염여부를 확인할 수 있다 사실이 아닙니다정기석 한림대성심병원 호흡기내과 교수코로나에 걸려서 간혹 폐섬유화증이 된다는 얘기는 돌고는 있지만 지금 여러 가지 정황을 봐서는 폐섬유화증이 되더라도 그렇게 심하지 않을 걸로 본다 폐렴이 진행하는 중에는 섬유화가 빨리 생기지 않는다 보통 섬유화라는 것은 폐렴을 심하게 앓으면서 그제야 생기는 것이다 폐섬유화라는 것은 병이 처음 시작할 때 바이러스에 의해서 오는 게 아니고 비특이적으로 특발성으로 온다게다가 그전 단계 숨 초 이상 참는 게 힘들면 폐섬유화증이 있는 거라고 볼 근거도 없습니다m 달리기나 계단오르기 등을 할 때 평소보다 숨이 많이 차면 호흡기나 폐기능에 이상이 생겼는지 의심할 수 있는 수준입니다대만 네티즌 사이에도 같은 내용이 우리보다 먼저 퍼져있었습니다JTBC 팩트체크처럼 국제팩트체킹네트워크IFCN 인증사인 타이완팩트체크센터도 이 내용을 검증했습니다 기사보기오류라고 결론 내렸습니다대만 전문가들이 제시한 코로나 자가진단법은 의학적 근거 없음가장 좋은 진단은 의료진과 상담하는 것,9.578947368421053,3.1578947368421053
6,발열 증세가 있는 중국동포가 진료를 기다리다가 도망을 갔다의사회 취재원소스 직접 확인검증 내용SBS뉴스화면 충남의 한 의사 단체 발송 문자 충남의 한 의사 단체에서 보낸 문자 메시지이다 발열 증세가 있는 중국동포가 진료를 기다리다가 도망을 갔다는 것이다 혼란을 불러올 수도 있는 내용인데 알아봤더니 저런 문자를 보낸 건 맞지만 검진 비용이 비싸 그냥 집으로 돌아간 게 도주극으로 와전됐고 경찰의 도움을 받아 이 분에 대한 검사까지 해봤는데 음성이 나왔다고 한다 의사회 관계자는 비응급환자여서 비용이 많이 나온다는 이야기를 듣고 부담스러워서 가셨었나 봐요 그래서 신고해서 경찰이 모시고 와서 검사했는데 음성으로 나와서 돌아가셨고라고 말했다전혀 사실 아님Powered by Froala Editor,11.6,7.0
7,홍콩 매체 명보明報는 최근 중국 네이멍구內蒙古 자치구에서 신종 코로나바이러스 확진자의 윗집 거주자가 감염됐다며 화장실이 새로운 바이러스 확산 경로일 가능성을 언급했다 이후 국내외 언론과 인터넷 등을 통해 기존 비말침방울에 의한 호흡기 감염 이외에 분변손음식입으로 이어지는 소화기 감염 우려가 쏟아졌다 언론 보도 내용과 관련 보고서 논문 전문가 인터뷰를 통해 화장실 감염이 구체적으로 어떤 것인지 실제 가능성은 있는지 검증했다화장실 감염의 대표적인 사례는 년 홍콩 타오다 아파트淘大花園이다 당시 주민 명이 중증호흡기증후군 사스에 집단으로 감염됐다 아파트 내 바이러스 발원지로 감염자가 사용한 화장실이 지목됐다 따라서 홍콩 아파트 사례가 실제로 있는지 당시 언론보도 등 확인했다 사스 관련 세계보건기구 WHO 보고서와 국제 의학 학술지 등을 검색해 관련 연구를 찾아보고 국내 전문가들의 의견을 들었다검증 내용 당시 언론보도를 보면 홍콩 아파트 집단 감염은 실재한다 WHO의 년 사스 보고서를 보면 감염자가 변기 물을 내리는 과정에서 체액이 미세한 입자들의 집합체인 에어로졸로 변했고 공기를 타고 화장실 배수구를 통해 위층으로 퍼졌다는 추정may이 나온다 역학조사 결과 확인됐다는 보고는 없다 년 월 미국 공공과학 도서관 온라인 학술지 PLOS에 영국 HeriotWatt University 연구진이 홍콩 타오다 아파트 사스 집단 감염 사례를 검증했다 연구진은 실제로 화장실 배수구를 통한 층간 감염이 가능하다는 사실을 실험으로 입증하는 데 성공했다 내용을 보면 변기 물 내리는 과정에서 분변에서 나온 체액이 에어로졸화했고 이후 배수구 내 공기 중으로 퍼지면서 위층으로 확산하는 과정이다 에어로졸을 통한 호흡기 감염 사례이지 분변  손  음식  입으로 이어지는 소화기 감염을 입증한 것은 아니다특히 영국 연구진은 특수한 조건을 전제했다 위층에서 환풍기를 틀어 상승기류가 발생하고 배수관이 말라 있어야 바이러스가 확산한다며 상승기류가 없을 때는 무시할 만한 정도라고 설명했다 환자가 설사할 때 소화기 감염 가능성이 커진다는 전문가 의견에 따라 신종 코로나바이러스의 증상과 관련한 논문을 확인했다 월 일 국제 의학 학술지 THE LANCET에 실린 신종 코로나바이러스 초기 감염자 명을 조사한 논문을 보면 설사 증상은 명에게서만 나타났다 전문가들은 설사 비율이 에 이른 사스와는 달리 이번 코로나바이러스는 설사 증상 비율이 낮다고 설명했다보건당국에서 지금까지 공식적으로 언급한 신종 코로나바이러스 확산 경로는 바이러스를 실은 침방울이 직간접적으로 입이나 코와 같은 호흡기로 들어갔을 때 전염되는 호흡기 감염이다 이것 말고 아직까지 분변  손  음식  입으로 이어지는 소화기 감염 경로가 입증된 것은 없다 홍콩 아파트 사스 집단 감염 사례도 관련 WHO 보고서와 영국 연구진 논문을 보면 소화기 감염이 아닌 호흡기 감염이다 설사 증상 비율이 낮아 소화기 감염의 가능성은 사스보다 상대적으로 떨어진다따라서 공중화장실을 새로운 감염 경로로 볼 근거는 아직 부족하다 전문가들의 공통된 분석이기도 하다 마스크 쓰기 손 씻기 등 기본 위생 수칙을 철저히 지키는 것이 가장 효과적인 감염 예방법이라고 전문가들은 입을 모았다최원석  고대안산병원 감염내과 교수  달라질 예방법은 없어요 결국 손 위생 잘하고 증상 있는 사람 마스크 쓰고 음식이나 물은 잘 익혀서 드시고 여기서 벗어나는 게 없거든요최재욱 고려대 예방의학교실 교수  공중화장실 감염가능성은 거의 제로라고 보는 게 맞는 거에요 벼락 맞을 확률과 비슷한 거에요 위험성을 처리하기 위해서 어떤 조치를 하거나 하는 것 자체가 오히려 더 큰 혼란을 일으켜요,13.37037037037037,3.185185185185185
