	qna_urls	titles	questions	answers	dates
262	https://kin.naver.com/qna/detail.nhn?d1id=7&dirId=70119&docId=350404656&qb=7L2U66Gc64KY&enc=utf8&section=kin&rank=263&search_sort=0&spq=0	부루펜정200밀리그램, 이부프로펜 복용해도 되는지?	신경통인지 근육통?때문인지 신경과에서 주사맞고 약을 처방 받았는데요? 약중에 부루펜정200밀리그램(이부프로펜)이 있더라구요..근데 요즘 뉴스를 보니까 코로나19 관련해서 이부프로펜을 복용하지 말라고하더라구요?저는 코로나확진자도 아니고 의심증상도 없는데, 검사는 해보진 않았습니다..병원에서 처방받은약 안심하고 먹어도 되는걸까요??괜히 코로나때메 심난하네요 ㅎㅎ;;	['안녕하세요. 네이버 지식iN 상담 약사 정일영 입니다.\u200b코로나에 감염된 것이 아니면 드셔도 괜찮겠습니다']	작성일2020.03.19
263	https://kin.naver.com/qna/detail.nhn?d1id=7&dirId=7010103&docId=350927822&qb=7L2U66Gc64KY&enc=utf8&section=kin&rank=264&search_sort=0&spq=0	피부병 같은데 알려주세요	5살아이구요. 손이 이렇게 되었는데요.첨엔 손바닥에 반점이 도돌도돌 올라오면서 손가락사이에 물집도 살짝생겨서 수족구인줄알았는데 열도 없고 발과 입에는 증상이 없었어요. 무슨병인가요?ㅠ요즘 신종코로나로 손소독제도 쓰고 손을 평소보다 자주씻긴했고..또 액체괴물(슬라임) 좀 지난걸 만진 후로 그런것같은 느낌도있습니다. 소아과.피부과 가봐도 딱 뭐라고 말은 없어서 알려주세요.	['많이 걱정되시죠?손끝이 그런거니  먼가 접촉하는  물건이나 물질과 관계가있을 가능성이 높아요의심되는것은 다 피해주세요가려워하나요?그러면  약물치료가 필요할수 있어요자주 씻는것도 피해주셔야합니다코로나 때문에 좀 난감하긴 하네요손소독제 사용도 최소화해야 합니다손으로 잡아 뜯지마시구요빠른회복을 기원합니다\u200b']	작성일2020.03.19
264	https://kin.naver.com/qna/detail.nhn?d1id=6&dirId=6080402&docId=351177049&qb=7L2U66Gc64KY&enc=utf8&section=kin&rank=265&search_sort=0&spq=0	급함)))미열이 몇주째 지속	21살 여자입니다강원도에 살고요 코로나는 절대 아니고37.1~37.5계속 몇주째 이런데어제는 타이레놀 먹어서 나았는데 계속 미열(?)이 있네요왜그런걸까요 ㅠㅠ기침은 안하고 콧물없고 가래없고 목뒤 뼈쪽만 몇달째 뻐근하긴 해요그래서 가끔 두통도 있고요어제 독감검사 받았는데 음성 나왔어요엄마는 양성 나오셨고요	['보통  오전에 37.3도,오후에 37.8도이상시  열이 있다고  봅니다코로나 감염같으면  길어도 3주이내,독감같으면  잠복기 1주이내에  38도이상의 고열과  몸살,두통,무기력감을동반한  호흡기 증세(인후통,기침,가래,콧물등)나  기타 증세(설사,구토등 소화기 증세)가 나타났을 것입니다만성 통증(목덜미쪽)과 두통 증세가 있다는 것으로 봐서  숙면을 못취하는 문제가 있는 것 같습니다자율신경계통의 장애가 흔히 생기는 이유가 첫번째  숙면을 못취하는 것입니다(잠들기 힘들거나  잠이 들어도 새벽에 자주 깨고   꿈을 많이 꾸고  낮에 꾸벅꾸벅  졸거나  만성 피로감을 느낌)그럴 경우  두통,안구건조증,비염,만성 기침,가래,역류성 식도염,소화불량,과민성 대장,빈뇨,만성 통증(목,어깨죽지,허리등),피부 알레르기등  다양한 증상이 동반됩니다한번도  이에 대한 검사를 받아보지 않으셨다면 혹시 자가면역질환이나 감염성 질환이 없는지  내과진료를 받아보시는게  우선일 것 같습니다\u200b']	작성일2020.03.22
265	https://kin.naver.com/qna/detail.nhn?d1id=7&dirId=70203&docId=351173051&qb=7L2U66Gc64KY&enc=utf8&section=kin&rank=266&search_sort=0&spq=0	아스피린에 소염제있나요?	두통이 4일째 안나아서 아스피린 먹어보려고 하는데 코로나 약간 의심돼서요... 코로나는 소염제있는 약 먹으면 안된다고 들어서요!ㅠㅠ 아스피린에도 소염제가 있나요?	['안녕하세요. 네이버 지식iN 상담 약사 정일영 입니다.\u200b코로나에 소염진통제 성분인 이부프로펜이 좋지 않다는 의견이 있으나, 아스피린에 이부프로펜 성분은 없습니다']	작성일2020.03.19
266	https://kin.naver.com/qna/detail.nhn?d1id=7&dirId=70127&docId=350460419&qb=7L2U66Gc64KY&enc=utf8&section=kin&rank=267&search_sort=0&spq=0	어제 카페가서 음료수와 빵먹는다고 마스크는 벗고있었고 카페화장실한번 이용했는데 오늘 낮에 목이 간지러워 기침 계속나왔어요 지금은 안 간지럽지만 평소 기관지가 좋지않긴했는데..열은 안나고 근육통이랑 설사는 해요. 코로나 인가요..?? ㅠㅠ 카페 가기전부터 배가 좀 아파서 설사는 한적있는데 근육통은 카페 간 후 생긴거 같아요. 갑자기 많이걸어서그런가요.? 열은 36도 도 안넘어요. 아 어제 잘때 숨쉬기가 좀 불편했고 지금도 숨쉬는게 조금 불편해요 코가 막히진않았는데 막힌것처럼 ㅠㅠ 코로나 걸린거면 어떡하죠	코로나 증상이 많던데 정확히 어떤 증상이 있나요? 제가 지금 감기가 걸렸거든요..... 어떤 증상이 코로나 증상이고 저는 코로나 증상에 걸렸는지도 궁금합니다! 그리고 만약...	['코로나는 증상으로 알 수 없지만지금 말씀하신 증상은 코로나는 아닌것 같습니다']	작성일2020.03.19
267	https://kin.naver.com/qna/detail.nhn?d1id=7&dirId=70117&docId=351182679&qb=7L2U66Gc64KY&enc=utf8&section=kin&rank=268&search_sort=0&spq=0	오른쪽 관자놀이 통증	저 며칠전부터 오른쪽 관자놀이 와 뒤통수가 뭔가 띵 하게 아파요 요즘 코로나라서 좀 겁이 나는데 코로나도 저런 비슷한 현상이 나타나나요?(참고로 지금 위염과 목감기가 있어요 그리고 눈에 압통도 있어요)	['안녕하세요. 대한의사협회·네이버 지식iN 상담의사 최율 입니다.직접적인 진찰이 아닌 상담으로 정확한 판단은 어렵지만, \u200b두통의 원인은 매우 다양합니다.그래서 두통의 원인이 무엇이라고 단정하기는 어렵습니다.\u200b우측 관자놀이와 뒤통수로 띵하게 아프다는 거지요?가장 흔한 두통의 원인은 경추성 두통, 긴장형 두통, 편두통 등이 있습니다.편두통의 경우에는 빛, 소리 등에 예민하고 구토가 동반되는 경우가 많이 있습니다.\u200b목의 근육은 후두부부터 견갑, 흉추까지 연결되어 있습니다. 좋지 않은 자세 등에 의하여 후두근 근육이 긴장을 하게 되면 두피로 가는 신경들을 압박하거나 근막을 자극하여 그 부위에 통증을 유발하는 경우가 많아요심한 경우에는 눈이 빠지는 듯한 통증까지도 유발을 합니다.이런 증상이 지속되면 만성이 되고 다른 증상이나 질환들을 유발할 수도 있습니다.\u200b코로나의 증상은 무증상부터 다양한 증상이 발생하기 때문에 무엇이라 단정할수는 없습니다.고열이 있으면서 감기증상이 있고 의심이 될만한 사람이나 장소에 접촉을 하였다면 1339에 전화를 하여 상담을 받아 보세요\u200b\u200b\u200b\u200b아래 내용은 참고로 읽어 보세요\u200b두통의 원인은 매우 다양합니다.뇌종양이나 뇌출혈보다는 대부분 1차성 두통인 경우가 많아요.대부분 뇌종양이나 뇌출혈 등은 다른 여러 증상을 동반을 합니다\u200b목이나 후두부의 근육에 의해서도 두통이 유발되기도 합니다.흉쇄유돌근등의 후두부 근육에 의하여 두피로 가는 신경을 포착하면 이런 증상이 발생할 수가 있습니다.머리를 흔들거나 목이 자극을 받으면 더 심해질 수도 있지요\u200b\u200b하나의 예로 아래 그림을 참고하시면 목의 근육이 두통이나 관자놀이, 이마 등에 통증을 일으킬 수가 있어요~(흉쇄유돌근 근육 외에도 두판상근 등 여러 근육등이 두통을 유발합니다. 아래 그림은 흉쇄유돌근이 일으킬 수 있는 통증 부위를 나타내는 것입니다.).\u200b                    \u200b 출처) headache 2014:54:1441-1459\u200b일반적으로 후두부에서 시작하는 통증, 특히 찌릿거리는 통증은 후두부 근육에 의한 신경의 압박을 인한 신경통일 가능성이 많습니다. 즉 경추성 두통이라고도 많이 부릅니다. 심한 경우는 안구통, 머리 전체의 통증, 구역, 어지러움까지도 일으킵니다.흉쇄유돌근등의 긴장이 같이 오는 경우 귀 주변의 통증도 동반되는 경우가 많아요.\u200b\u200b운동을 하거나 목에 힘이 많이 들어가는 경우(스마트폰, 누워서 TV 시청, 스트레스)에 근육이 긴장되면서 일으키는 경우가 많은데요,,\u200b하지만 혈압의 상승으로 인한 두통일 가능성도 있습니다. 혈압을 측정해 보시는 것도 도움이 됩니다.\u200b\u200b경추성 두통의 경우는 물리치료, 약물치료, 후두 신경치료(신경치료 후 증상의 호전을 관찰하여 경추성 두통 등과 감별) 등을 하게 됩니다. 또한 평소 목의 자세도 중요한 원인 중 하나입니다. 따라서 스트레칭, 좋은 자세를 하셔야 합니다.위의 증상이 의심된다면, 후두부 머리카락 라인을 주변으로 해서 손으로 부드럽게 만져보고 압통이 있으면 손으로 마사지를 해주세요. 자주 일어나서 움직이고요 턱을 두 손으로 뒤로 가볍게 밀어서 목이 앞으로 나오지 않게 자세를 해주세요빠른 쾌유 바랍니다.']	작성일2020.03.23
268	https://kin.naver.com/qna/detail.nhn?d1id=7&dirId=70106&docId=350778440&qb=7L2U66Gc64KY&enc=utf8&section=kin&rank=269&search_sort=0&spq=0	헬스장 인포 에서 일하고 있습니다	헬스장 인포에서 아침7시부터 오후 4시까지 일하고있습니다. 근로계약서를 쓰고 입사를 하였기에 당연히 계약직 또는 정규직인줄 알았는데대출을 알아보는 과정중에 은행에서 4대보험도 미가입에 3.3프로 세금을 떼고 월급을 받아서 프리랜서라고 합니다.그리고 하루 일하는 시간에 점심시간1시간에 입사하고 난뒤 식비포함 150이라고 말하더라구요..이럴경우 어떻게 대처해야하나요??또 코로나 땜에 저희 의도와는 상관없이 헬스장이 3일 쉬었는데 20만원정도 깎여있구요..제가 이런쪽은 좀 무지해서 도움요청드려요 ㅠㅠ	['안녕하세요. 한국공인노무사회-네이버 지식iN 상담 공인노무사 김태윤 입니다.\u200b1일 8시간, 주 5일근로했다면 주휴수당을 포함한 월 임금액은 1,795,310원입니다. \u200b근로시간 및 근로일을 입증할 수 있다면 사용자에게 최저임금 차액을 청구할 수 있으며, 최저임금법 위반으로 사업장 관할 노동청에 진정을 제기할 수 있고, 사업장내에 코로나 환자가 발생한 것이 아니라 사용자가 근로자들에게 일방적으로 3일을 쉬라고 했다면 휴업급여가 발생되기 때문에 월 임금에서 20만원을 공제하는 것이 아니라 3일은 평균임금의 70%를 받아야 하는 것입니다.']	작성일2020.03.26
269	https://kin.naver.com/qna/detail.nhn?d1id=7&dirId=70117&docId=351210376&qb=7L2U66Gc64KY&enc=utf8&section=kin&rank=270&search_sort=0&spq=0	오른쪽 가슴통증	제목 그대로 오른쪽 가슴 통증이 생겼어요... 왜그러는걸까요ㅠㅠ코로나 증상에도 가슴통증이 있길래 적어봅니다ㅠㅠㅠ 살짝 누르는 느낌이구요 오래는 안가고 아팠다 안아팠다 합니다...왜이러는걸까요ㅠㅠㅠ	['안녕하세요. 대한의사협회·네이버 지식iN 상담의사 홍인표 입니다.코로나는 증상만으로 알수없지만 코로나는 아닌것 같고  일시적으로나타나는 비특이적 흉통  아마도  가슴 근육이나 연골에서  생기는 통증으로 생각됩니다']	작성일2020.03.24
270	https://kin.naver.com/qna/detail.nhn?d1id=7&dirId=70117&docId=351339195&qb=7L2U66Gc64KY&enc=utf8&section=kin&rank=271&search_sort=0&spq=0	국제결혼 안내 프로그램 이수에 관한 질문입니다.	안녕하세요 수고 많으십니다F-6비자 신청 준비중인데 국제결혼 안내프로그램 대상국가가중국,베트남,필리핀,캄보디아,몽고,우즈벡,태국 으로 알고있습니다러시아도 해당이 되나요? 그리고 지금 코로나 19때문에 해당 프로그램을 교육 받을수 없는 상황이라고 알고 있고 하늘길이 막혀 제가 주러 한국 대사관에 직접 방문 할수가 없어 국제 택배를 통해 F-6신청에 필요한 서류들을제 와이프에게 보내서 신청하려 합니다. 혹시 이런경우에는 비자발급에 큰 문제가 생기나요?	['안녕하세요. 로시컴-네이버 지식iN 상담변호사 문종술 입니다.\u200bF-6비자 신청 준비중인데 국제결혼 안내프로그램 대상국가가 중국,베트남,필리핀,캄보디아,몽고,우즈벡,태국 으로 알고있습니다 러시아도 해당이 되나요? \u200bAnswer:\u200b러시아는 해당이 안됩니다 오히려 포함이 되는 것이 더 불리할 수 있습니다.  http://www.socinet.go.kr/soci/contents/PgmIntrMarr.jsp?q_global_menu_id=S_GIM_SUB01           사회통합정보망 사회통합프로그램 신청안내 귀화대상자 종합평가 신청 사회통합프로그램 평가신청 사회통합프로그램 과정신청 조기적응프로그램 신청 국제결혼 안내 프로그램 신청 평가일정 공지사항 사전평가 -  평  가  명  :  2020년 사전평가 5차 -  평가일자 :  2020.04.25 -  입실마감시간 : 12:30 -  신청시작일자 : 2020.04.07 -  신청종료일자 : 2020.04.13 중간평가 -  평  가  명  :  2020년 중간평가 1차 -  평가일자 :  2020.05.09 -  입실마감시간 : 12:30 -  신청시작일자 : ... www.socinet.go.kr            \u200b그리고 지금 코로나 19때문에 해당 프로그램을 교육 받을수 없는 상황이라고 알고 있고 하늘길이 막혀 제가 주러 한국 대사관에 직접 방문 할수가 없어 국제 택배를 통해 F-6신청에 필요한 서류들을제 와이프에게 보내서 신청하려 합니다. 혹시 이런경우에는 비자발급에 큰 문제가 생기나요?\u200bAnswer:\u200b러시아의 한국 영사관이나 대사관을 통해 접수하는 것이 맞을 거 같습니다 비자 발급에 특별히 문제가 될 부분은 없습니다']	작성일2020.03.24
271	https://kin.naver.com/qna/detail.nhn?d1id=6&dirId=60802&docId=351064719&qb=7L2U66Gc64KY&enc=utf8&section=kin&rank=272&search_sort=0&spq=0	목이 아파요	침을 삼킬 때 뭔가 혀 밑에 목 쪽이 아픈거 같아요턱 밑 쪽으로 눌렀을 때도 아프고요인후통인가요?열은 없습니다.코로나 증상 의심하지 않아도 되겠지요?	['인후통이있고  목에 임파선이 커져있을가능성이 높아요증상으로 코로나를 의심하기 어렵지만  코로나는 아닌것 같습니다']	작성일2020.03.21
272	https://kin.naver.com/qna/detail.nhn?d1id=6&dirId=60217&docId=351004770&qb=7L2U66Gc64KY&enc=utf8&section=kin&rank=273&search_sort=0&spq=0	혓바늘과 인후통	제가 3일전 부터 갑자기 혓바늘이랑 인후통이 동시에 생겨서요..코로나 증상 보니깐 3~4일 인후통증에 그 다음부턴 마른기침 생기고 14일 이내에 발열이 생긴다던데.. 목이 심하게 부어서 침 삼키기도 힘들고 그러네요.. 제가 요 근래에 어디 멀리 돌아다닌적이 없어서요.. 기껏해야 운전면허학원 정도에 아파트 단지에서 운동한것 밖에 없구요.. 저희 동네는 청정지역이라 지금까지 코로나 확진자가 한명도 안나와서.. 운전면허학원 주위도 그렇고 거기에 있는 사람도 그렇고 확진자도 없구요.. 그리고 문자에 날라오는 확진자들 동선보니깐 저랑은 관련없는 지역이였구요.. 제가 알바도 하는데 거기에도 확진자 동선이랑 정반대였어요 그냥 단순 신경 때문에 그런건지.. 뭐 환절기라서 그런건지.. 요즘 시국에 작은 병원가기도 너무 애매하고.. 아니면 제가 운동다닐때 너무 얇게 입고 가서 그런건지.. 너무 무섭고 그래요..보건소 가서 진단이라도 받아봐야할까요?	['안녕하세요. 대한의사협회·네이버 지식iN 상담의사 홍인표 입니다.요즘 코로나때문에 몸에 조금이라도 증상이 생기면 걱정이 많습니다너무 걱정되면 코로나 검사를 받아보시는것이좋겠네요증상으로만 코로나를 알 수 없으나  지금 증상은 코로나는 아닌것 같아요빨리회복하세요']	작성일2020.03.20
273	https://kin.naver.com/qna/detail.nhn?d1id=6&dirId=6080402&docId=351257284&qb=7L2U66Gc64KY&enc=utf8&section=kin&rank=274&search_sort=0&spq=0	목아픔 인후신 캡슐	목이 슬 아프길래 인후신 캡슐 두알 먹었는데 ... 코로나19에 항염증제가 위험하다길래괜찮을까요??ㅠㅜ	['안녕하세요. 네이버 지식iN 상담 약사 박기범 입니다.\u200b코로나 19에서 이야기하고 있는 항염증제와 인후신의 주성분인 은교산은 조금 다른 범위의 약입니다. 너무 걱정 않으셔도 됩니다. ^^']	작성일2020.03.21
274	https://kin.naver.com/qna/detail.nhn?d1id=7&dirId=70205&docId=350488899&qb=7L2U66Gc64KY&enc=utf8&section=kin&rank=275&search_sort=0&spq=0	편두통이 계속되고 어지러워요	3일동안 계속 머리도 아프고 어지럽고 입맛도 없는데 왜그런가요ㅠㅠ?기침이랑 발열은 없는데 코로나는 아니겠죠...?	['평소에 편두통으로 고생을 하시는 군요코로나는 아닌것 같습니다편두통이 심하면   3일 이상 지속되기도 합니다혹시 스트레스 많으신가요?']	작성일2020.03.27
275	https://kin.naver.com/qna/detail.nhn?d1id=7&dirId=70204&docId=350671138&qb=7L2U66Gc64KY&enc=utf8&section=kin&rank=276&search_sort=0&spq=0	목 통증 질문	아픈위치는 목젖 양옆, 턱 아래쯤 입니다거기서 부터 쭉 타고 아래쪽 까지 통증이 있습니다침 삼킬때 아프진 않아도 느낌이 나는 정도구요아픈 부위를 중심으로 해서 목 앞쪽에 열감이 있습니다크게 멍울이 느껴지진 않는데 누르면 더 아프고전체적으로 부은 느낌이 있어요편도는 괜찮은것 같아 임파선염이 가장 걱정됩니다1. 당장 집에서 할 수 있는 처치는 무엇인지,2. 음식이나 음료는 뭐가 좋은지3. 약을 먹는다면 감기약과 소염제중 무엇이 맞는지4. 병원은 어디로 가야하는지5. 혹시 코로나일 가능성이 있는지 답변부탁드립니다(걱정될만한 동선이나 주변인 접촉은 전혀 없습니다)	['안녕하세요. 대한의사협회·네이버 지식iN 상담의사 정현화 입니다.1.없습니다.2.특별히 없습니다.3.소염제 조금 드셔 보세요.4.외과 진료 보세요.5.코로나 거리 있어요.\u200b']	작성일2020.03.21
276	https://kin.naver.com/qna/detail.nhn?d1id=6&dirId=60206&docId=350771227&qb=7L2U66Gc64KY&enc=utf8&section=kin&rank=277&search_sort=0&spq=0	눈알 두통 가래 인후통 목 뻐근	그저께 부터 눈알 왼쪽이 너무 아프고 두통도 좀있고 물이 너무 마시고 싶고 가래가 좀 있고 침 삼길때 목아픔 , 목쪽에 뻐근함 ?? 도 있어요 .. 코로나 인가요 .. ? : 대구거주 : 해외 다녀온적 없음	['안녕하세요. 대한의사협회·네이버 지식iN 상담의사 홍인표 입니다.많이 걱정되시죠? 얼마나 되셨나요?증상만으로 코로나는 알수 없지만  아닌거 같긴 합니다1339전화 문의 해보세요']	작성일2020.03.23
277	https://kin.naver.com/qna/detail.nhn?d1id=7&dirId=70117&docId=351172644&qb=7L2U66Gc64KY&enc=utf8&section=kin&rank=278&search_sort=0&spq=0	궁금한거 있는데요 열,기침은 아예 없는데 눈 간지러우면 이것도 코로나랑 관련있나요?	코로나 증상이 많던데 정확히 어떤 증상이 있나요? 제가 지금 감기가 걸렸거든요..... 어떤 증상이 코로나 증상이고 저는 코로나 증상에 걸렸는지도 궁금합니다! 그리고 만약...	['안녕하세요. 대한의사협회·네이버 지식iN 상담의사 정현화 입니다.코로나와 거리 있어요.37.5도 이상의 열 기침 근육통 피로 있으면1339나 보건소 연락해서 상담 하세요.']	작성일2020.03.22
278	https://kin.naver.com/qna/detail.nhn?d1id=7&dirId=70117&docId=351169269&qb=7L2U66Gc64KY&enc=utf8&section=kin&rank=279&search_sort=0&spq=0	안녕하세요 제가 19일 날 밖에서 놀	안녕하세요 제가 19일 날 남자친구랑 밖에서 놀았는데(둘다 마스크 쓰고) 그러다가 21일 토요일 저녁? 부터 머리가 좀 아프고 열이 났습니다 처음엔 37도 정도 였다가 38.2?4?까지 올랐어요 침 삼킬 때 마다 목도 아팠구요 그러다가 22일 아침 쯤에 타이레놀 하나를 먹고 잤더니 열은 내렸습니다 머리가 어제까지 지끈? 거리긴 했는데 지금은 괜찮아졌고 침 삼킬 때 마다 목이 조금 아프긴 한데 아프다 안 아프다 합니다 가슴통증도 조금씩 있구요 ( 가슴통증은 예전부터 조금씩 있긴 했어요) 근데 방금 밥 먹다가 배가 아파서 화장실에 가니까 설사가 조금 나오는데...혹시 저 코로나 인가요? 확진자랑 동선 겹치지도 않았고 남자친구는 아무 이상이 없어요! 아 그리고 제가 몸이 좀 약해서 평소에도 한달에 1번 정도 머리가 아프긴 해요 빈혈?도 있는거 같고.. 꼭 답변 부탁드려요 ㅠㅠ	['안녕하세요. 대한의사협회·네이버 지식iN 상담의사 정현화 입니다.코로나 19가능성 있어요.2-3일 집에서 지켜 보시고37.5도 이상의 열 기침 근육통 피로있으면 1339나 보건소 연락해서 상담 하세요.\u200b']	작성일2020.03.24
279	https://kin.naver.com/qna/detail.nhn?d1id=7&dirId=70117&docId=351190619&qb=7L2U66Gc64KY&enc=utf8&section=kin&rank=280&search_sort=0&spq=0	이거 무슨 질환일까요?ㅠㅠ	제가 한 5주간 다이어트를하면서 저녁에 닭가슴살위주의 식사를 하고 운동을해서 10kg 감량을했습니다. 이후 코로나 19사태로 인해 집에서 머물게 되었으면 야식을 자주 하고 최근에는 돈까스나 삼결살 소고기류를 매일 섭취했는데요가슴이 타는 듯한 느낌이나고 목이 맵고 코가 막힙니다. 코가막혀서 숨쉬는 것도 힘들고요걱정이많이 됩니다. ㅠㅠㅠ 답변부탁드려요.	['코로나를 증사으로만 구별할 수는 없지만 코로나는 아닌듯하고  야식때문에  위식도 역류 증상이 생긴것은 아닌가싶고코막히고 목아프고 하는증상은  감기 증상이아닌가 싶어요알러지 비염있나요?']	작성일2020.03.25
280	https://kin.naver.com/qna/detail.nhn?d1id=7&dirId=70203&docId=350846501&qb=7L2U66Gc64KY&enc=utf8&section=kin&rank=281&search_sort=0&spq=0	늑막염의심	시어머니 한달넘게 감기증상있어 일반병원다니면서 몇칠전 늑막염의심된다고 하시는데 현재증상은 기침 약간에 오한 코로나가 의심될까요	['안녕하세요. 하이닥-네이버 지식iN 상담의 이정찬 입니다.코로나보다는 결핵성 늑막염일 가능성이 우리나라에서는 많습니다. 조직 검사를 해서 확진을 내릴 필요가 있겠습니다.감사합니다.']	작성일2020.03.22
281	https://kin.naver.com/qna/detail.nhn?d1id=6&dirId=60202&docId=350586907&qb=7L2U66Gc64KY&enc=utf8&section=kin&rank=282&search_sort=0&spq=0	이게 어떤 병 증상일까요?ㅠ	엄마가 어제부터 열이 37.4~ 38.3 정도를 왔다갔다 하시고 목도 살짝 아프시다고 하고 머리가 지끈지끈하다고 하시는데요..설사도 하시고요코로나때문에 고지혈증이 있으신데 보름정도 약을 안드시다가 머리가 살짝 아프시다며다시 드신지 3일째인데 이게 고지혈증하고 관계가 있는 증상일까요?코로나때문에 섣불리 병원에 가보기도 뭐하고 열이 아주 높은건 아니고 해열제(타이레놀)을 먹으면열은 또 떨어지고(어지럼증/지끈지끈하다고 하심) 해서 일단 내일 병원에 전화만 해보려고 하는데일단 증상만 보면 장염같기는 한데 타이레놀, 항생제는 드셨거든요.. 약은 글 작성시간까지 총 네번 드셨고약을 먹으면 열은 내리고 설사와 두통은 그대로이신것 같습니다혹시 큰 병의 전조증상일지 걱정됩니다 답변 부탁드려요ㅠ	['일단은 열이나니  지속되면  코로나의 가능성을 염두어 두어야 하나설사를 하신다고 하니 장염의 가능성이 더 높다고 생각합니다고지혈증과 관계는 없어보입니다']	작성일2020.03.24
