	qna_urls	titles	questions	answers	dates
757	https://kin.naver.com/qna/detail.nhn?d1id=7&dirId=70120&docId=351216009&qb=7L2U66Gc64KY&enc=utf8&section=kin&rank=758&search_sort=0&spq=0	안녕하세요 제가 겪고있는상황은 이렇습니다2019년 11월~12월쯤 일인데요저는그때당시 친구네집에서 지내고있었고 친구와 친구와이프와 저와 셋이 있었습니다친구 와이프인 후배는 제전여자친구였고같이술을먹었고 잠잘시간이되서 잠을잤습니다방은 두개였고 친구는 친구와이프와저는 전여자친구와 잠을잤습니다저는 어쩌다보니 전여자친구에게 스킨쉽을했고 어쩌다보니 입술이 닿여서 키스를했습니다 그러다가 관계를 하였고 삽입하자마자 생리가끝나지않앗다며 하기싫다고해서 바로뺏었습니다 그뒤로 저희둘은 연락도한적도없고 그전여자친구는 그때당시 남자친구가 또있었고 해서 연락도하지않았습니다 그리고현재 2020년 3월중순 최근에연락이왔습니다 카톡으로말입니다 전여자친구는 잘지내? 라는 카톡이왔고그래서저는 잘지낸다고 하였고 나안보고싶어라고 카톡이왔고 자꾸만나자고하길래 저는 이시국에 봐서뭐하냐 코로나때문에 난리인데 만나냐고 하자 전여자친구는 텔갈까?사람일은모르니까 털가서 나힘든것좀 위로해줘 술도먹고 좋은시간도보내자라는 카톡이왔고 그카톡내용 캡처해놓은상태입니다 -그 전여자친구는 2019년11월~12월사이에 있었던일을 성폭행했다고 돈을 무리하게 500만원 준비해라 100만원준비해라 상황많이봐주고있다 안주면신고하고 고소할거다 라고 신고한다고 협박중입니다 계속 카톡으로 연락안봣냐 계속 사람 심리적으로 협박하고 그러고있습니다 하루에5만원씩이라도보내라 상황이힘들면 그러면 없었던일로쳐주겠다 이러고있습니다 제발도와주세요 자세하게 답변해주세요 어떻게해야되는지 ..	코로나 증상이 많던데 정확히 어떤 증상이 있나요? 제가 지금 감기가 걸렸거든요..... 어떤 증상이 코로나 증상이고 저는 코로나 증상에 걸렸는지도 궁금합니다! 그리고 만약...	['안녕하세요. 서울지방변호사회-네이버 지식iN 상담 변호사 송재성 입니다.\u200b성 관련 범죄 혐의에 있어서는 다른 물질적 증거가 없더라도 피해자의 진술만 가지고도 형사절차에서 범죄가 인정되는 경우가 많습니다. 법원이 최근 성인지 감수성을 근거로 피해자 진술의 신빙성을 광범위하게 인정하는 추세이기 때문입니다.\u200b다만, 사안의 경우 실제로 강간고소가 이루어진다면 상대방과의 성관계를 암시하는 내용의 카톡메시지 등을 근거로 혐의를 벗기 위하여 노력하여야 할 것입니다. 이에 앞서 허위의 강간사실을 들어 금원을 요구한 상대방을 공갈죄나 공갈미수죄로 의율하여 형사고소하는 방안도 생각해 볼 수 있습니다. \u200b성 관련 범죄에 연루되는 것을 미연에 방지하고 상대방에게 입은 그동안의 정신적인 고통을 조금이나마 배상받기 위하여 변호인의 선임 등도 고려하시길 바랍니다. \u200b\u200b추가적 질의가 있거나 법률적 조력을 원하신다면 하단의 네임카드 연락처를 참고하셔서 언제든지 부담없이 유선상으로 문의주시길 바랍니다.']	작성일2020.03.26
758	https://kin.naver.com/qna/detail.nhn?d1id=6&dirId=6080402&docId=350996661&qb=7L2U66Gc64KY&enc=utf8&section=kin&rank=759&search_sort=0&spq=0	무인텔 민사 매매 전문 서초 변호사님 수임할 분 찾습니다.	판사 출신 서초 변호사무인텔 매매 중도금까지 받았는데 상대방에서 말도 안되는 꼬투리를 잡아 계약파기 요청하며 중도금과 계약금 3억7천만원과 연이율 12%로 이자까지 지급하라고 변호사 선임해서 민사소송을 걸어왔습니다. 부모님 사업인데 실력있는 가급적 판사출신 변호사님을 찾습니다. 반드시 이겨야 하는 소송이고 상대방측에서 선임한 변호사가 서초 변호사이고 서울중앙지방법원에 소송을 냈습니다. 상대 변호사가 작성한 소송장에는 허위사실과, 매매 계약과 무관한 이야기까지 쓰여있어 황당함 그 자체입니다. 반드시 이겨야 하는 소송으로 저희 입장은 계약 완료해서 무인텔 매매완료로 남은 잔금과 그 이자까지 저희에게 지급하게 하는 것이 목적입니다. 자식 된 입장에서 부모님께서 피땀흘려 정말 20년동안 피같이 모으신 돈으로 무인텔 하나 운영하시는데 그거 매매하시고 다른 일 하시려다가 부동산 하는 이상한 여자한테 휘말려서 중도금 잔금도 기일보다 훨씬 늦게 지급하고 간만 보고 빠지고 이제와서 코로나로 부동산이나 숙박업소 전망 안좋아지니 빠지려는 속셈이 너무 괘씸합니다. 그동안 그년이 저희 아버지께 언제까지 잔금 다 치르겠다 매매완료하겠다 작년 12월말부터 계속 미뤄오다가 올해 설 전까지 가져가겠다 하여 영업을 중단한 상태였는데 또 영업 중단해서 손님이 없다는 이유까지 소송장에 적었더군요. 상식이 전혀 결여된 악질적인 여자가 저희 아버이 농락 우롱 몇달동안 해온거 올해 서른인 자식 입장에서 도저히 두고볼수가 없어서 문의드립니다. 판사 출신으로 민사소송의 쟁점을 잘 알고 계시거나 건물 매매 관련 경험이 풍부하시고 핵심 잘 짚어내시며 열심히 해주셔서 꼭 승소로 이끌어주실 변호사님을 애타게 찾습니다.	[]	작성일2020.03.20
759	https://kin.naver.com/qna/detail.nhn?d1id=7&dirId=70304&docId=351050058&qb=7L2U66Gc64KY&enc=utf8&section=kin&rank=760&search_sort=0&spq=0	공부 잘하는건가요?	안녕하세요 예비 초4에요 제가 공부 잘하는건지 알고싶어서 이렇게 질문 남깁니다초3일 때는 성적이 90점 밑으로 단 한번도 내려간 적 없고 요즘은 코로나 때문에 방콕하면서 공부합니다초4 문제를 예습하고 있는데 잘 풀다가 어버버버하는 문제가 꼭 하나씩은 나오더라구요그래서 그런 문제는 일단 넘어가고 다른문제 풀다가 운 좋게 다른문제에 답이 나와서 따라적을 때도 있죠ㅎ근데 그러지 않았을 경우엔 어떻게 하겠습니까?...예...틀리는 거죠...뭐그래서 제가 공부 지금 잘하고 있는건지 알려주시고 공부 잘하는법 좀 알려주세요제가 요즘 1문제 틀리는거에 예서반응입니다.....게다가 꿈도 같아요...서울의대 진학해서 의사되는거...요즘 정말 죽고싶어요...저같은 못생기고 공부도 못하는 돌대가리가 왜 태어났는지...차라리 죽으면 이 고통을 덜 느낄수 있지 않을까요? 자X하고는 싶은데 아플거 같아서 못하겠고 안락사 하고 싶습니다 안락사 약 구하는 방법은 또 없을까요?ㅎ	['안녕하세요. 대한의사협회·네이버 지식iN 상담의사 전평식 입니다.\u200b그렇게 혼자서 하는 것만도 잘 하는 것입니다.이제 다다음주면 학교에 갈 수 있으니 너무 성급하게 생각하지 말고 지금처럼 하다가학교에서 배우세요.']	작성일2020.03.27
760	https://kin.naver.com/qna/detail.nhn?d1id=7&dirId=70204&docId=350413578&qb=7L2U66Gc64KY&enc=utf8&section=kin&rank=761&search_sort=0&spq=0	판사 출신 서초 변호사 무인텔 매매 중도금까지 받았는데 상대방에서 말도 안되는 꼬투리를 잡아 계약파기 요청하며 중도금과 계약금 3억7천만원과 연	판사 출신 서초 변호사무인텔 매매 중도금까지 받았는데 상대방에서 말도 안되는 꼬투리를 잡아 계약파기 요청하며 중도금과 계약금 3억7천만원과 연이율 12%로 이자까지 지급하라고 변호사 선임해서 민사소송을 걸어왔습니다. 부모님 사업인데 실력있는 가급적 판사출신 변호사님을 찾습니다. 반드시 이겨야 하는 소송이고 상대방측에서 선임한 변호사가 서초 변호사이고 서울중앙지방법원에 소송을 냈습니다. 상대 변호사가 작성한 소송장에는 허위사실과, 매매 계약과 무관한 이야기까지 쓰여있어 황당함 그 자체입니다. 반드시 이겨야 하는 소송으로 저희 입장은 계약 완료해서 무인텔 매매완료로 남은 잔금과 그 이자까지 저희에게 지급하게 하는 것이 목적입니다. 자식 된 입장에서 부모님께서 피땀흘려 정말 20년동안 피같이 모으신 돈으로 무인텔 하나 운영하시는데 그거 매매하시고 다른 일 하시려다가 부동산 하는 이상한 여자한테 휘말려서 중도금 잔금도 기일보다 훨씬 늦게 지급하고 간만 보고 빠지고 이제와서 코로나로 부동산이나 숙박업소 전망 안좋아지니 빠지려는 속셈이 너무 괘씸합니다. 그동안 그년이 저희 아버지께 언제까지 잔금 다 치르겠다 매매완료하겠다 작년 12월말부터 계속 미뤄오다가 올해 설 전까지 가져가겠다 하여 영업을 중단한 상태였는데 또 영업 중단해서 손님이 없다는 이유까지 소송장에 적었더군요. 상식이 전혀 결여된 악질적인 여자가 저희 아버이 농락 우롱 몇달동안 해온거 올해 서른인 자식 입장에서 도저히 두고볼수가 없어서 문의드립니다. 판사 출신으로 민사소송의 쟁점을 잘 알고 계시거나 건물 매매 관련 경험이 풍부하시고 핵심 잘 짚어내시며 열심히 해주셔서 꼭 승소로 이끌어주실 변호사님을 애타게 찾습니다.	['안녕하세요. 서울지방변호사회-네이버 지식iN 상담 변호사 김상철 입니다.\u200b구체적인 사실관계가 제시되지 않아 정확히 판단할 수 없지만 질문과 같은 사안은 매매계약에서 흔히 발생하는 분쟁 유형으로서 계약위반 사항이 있는지, 이 사항에 대하여 계약서에 별도로 해제권 유보 약정을 했는지 등등 계약 해제의 정당성 여부가 쟁점인 것으로 보입니다. \u200b먼저, 매수인 주장 사유가 매매계약서에 기재되었는지 여부를 확인하거나 이에 대한 구두 약정이 있는지를 살펴보는 것이 분쟁 해결에 큰 도움이 될 것으로 보입니다.']	작성일2020.03.20
761	https://kin.naver.com/qna/detail.nhn?d1id=6&dirId=6080402&docId=351221712&qb=7L2U66Gc64KY&enc=utf8&section=kin&rank=762&search_sort=0&spq=0	경찰서 신고 취하	제가 중고거래를 하다 어찌어찌해서편의점 기계오류? 때문에 택배를 보냈는데 받는곳이 안적혀서 운송장 조회해도 암것도 안뜨고 하니깐 저는 수거를 코로나 사태때뭄에 아직 안한거 같다 했고 저도 그런줄 알았어요. 근데 구매자가 경찰서에 사기로 신고를했어요;;(저는 몰랐음) 그러고 제가 한1~2주뒤 다시보냈는데 구매자도 물건 잘받고 해서 일이 잘 마무리 된건줄 알았는데 한 2주뒤에 경찰서에서 전화랑문자가 왔더라고요... 조사받으러 미성년자니깐 부모님이랑 몇일뒤에 오라 일단 메일로 그때일 써서 보내봐라;; 저는 물건도 잘보내고 사기친것도 없는데 운송장 오류때 저도 모르게 신고를 했더라고요;; 그래서 구매자랑 연락을 해봤는데 물건 받고 신고 취하했다 담당경찰관이 배정되면 경찰서에서 다시 연락을 주신다고 기다리면 해결되니 걱정하지마라 이렇에 말하시는데 이러면 저는 경찰서 갈일 없는거죠? 구매자가 신고 취하를 했다니깐 저는 조사받을일도 없는거죠?	['안녕하세요. 서울지방변호사회-네이버 지식iN 상담 변호사 김태환 입니다.상대방이 질문자분을 절도죄로 고소후 형사입건되었다면 질문자분은 피의자 신분으로 수사를 받게 됩니다. 또한, 절도죄는 친고죄나 반의사불벌죄가 아니기 때문에 고소인이 고소취하를 하였다고 하더라도 수사는 계속됩니다. 따라서 담당조사관에게 소환통지가 온다면 질문자분은 수사를 받아야할 것으로 보이며, 수사과정에서 운송장 오류와 물건배송이 완료된 사실에 대해 진술하면 될 것으로 보입니다.']	작성일2020.03.26
762	https://kin.naver.com/qna/detail.nhn?d1id=7&dirId=7011401&docId=351157774&qb=7L2U66Gc64KY&enc=utf8&section=kin&rank=763&search_sort=0&spq=0	부동산 기망행위로 계약해지 및 계약금 반환	1. 실태(A : 아파트 매수자, 아들 / B : A 부모)- A : 2020.3.20(금) 부동산 직방 아파트 매매정보(30평, 145백만원)보고 부동산 전화하쟈 방문 상담 권유,-당일 A가 부동산 방문하여 직방에 올라온 145백만원 매물 문의하쟈 코로나로 집을못본다고 말하고 어떤 아파트를 찾냐고 해서 리모델링 되어있고 금액은 1억6-7천사이라고 말하쟈 2층에 1억6천5백에 나온거 있고 1억6천까지 가능하다고 해서 2백 내린 158백만원 매매하기로 하고 A는 계약금 3백만원을 매도인 구좌로 송금함-3.21(토), B는 A가 아파트 매매 애기를 하쟈 3.21(토)일 오전 직방에 올라온 아파트중 A가 계약한물건이 저층145백만원으로 게시된걸로 보고 부동산에문의하쟈 직방 물건은 2층이며 급매로 나왔으며 3.20일 계약됐다고 부동산에서말함 * 동물건은 3.20일 직방에 올렷으며 A, B가 계속 문의하쟈 3.21일 직방에서 삭제함-바로 B는 A에게 직방 매물 캡처 후 보내주고 부동산에 자세히 알아보라고 하쟈 A는 부동산에 직방에 나온 145백만원 물어보쟈 부동산에서는 20평을잘못 올렸다고 하면서 바로 직방에서 동 물건을 삭제함- 3.22(일) B가 부동산에 전화해서 A 부모라고 말하고 A가 계약한 물건이 직방에 145백인데 158백만원에 계약한 사유를 물어보쟈 165백만원에 나온 물건이라고만 말하고 직방에 나온 145백만원 아파트는 3.20일A에게 매매한 물건이라고 인정함, 계약금만 반환해주고 원만히 종결하쟈 하쟈 반환의무가 없다고 말함2. 문의-기망행위로 계약해지와 계약금 3백만원을 반환받을 수 있는지.- 반환 못해준다고 하면 법적 방법은	['안녕하세요. 생활법률연구회-네이버 지식iN 상담변호사 송주영 변호사입니다\u200b주어진 내용을 보면 단순착오에 의한 실수로서 기망행위라고 보기 어려운 점이 있습니다. 부동산업자가 보다 적극적으로 사술을 사용하여 질문자님을 기망했다는 점에 대한 추가적인 증거가 필요해 보입니다. 만약에 추가적인 증거가 있다면 민법 제110조에 따라 사기를 이유로 계약을 취소하고 3백만원을 반환을 요구할 수 있습니다.\u200b이때 상대방이 응하지 않는다면 결국 소송으로 해결해야할 것입니다. \u200b<민법>제110조(사기, 강박에 의한 의사표시) ①사기나 강박에 의한 의사표시는 취소할 수 있다.②상대방있는 의사표시에 관하여 제삼자가 사기나 강박을 행한 경우에는 상대방이 그 사실을 알았거나 알 수 있었을 경우에 한하여 그 의사표시를 취소할 수 있다.③전2항의 의사표시의 취소는 선의의 제삼자에게 대항하지 못한다.\u200b보다 상세한 상담을 원하시면 언제든지 전화주시거나 방문하여 주시기 바랍니다. 감사합니다']	작성일2020.03.23
763	https://kin.naver.com/qna/detail.nhn?d1id=7&dirId=70111&docId=350721979&qb=7L2U66Gc64KY&enc=utf8&section=kin&rank=764&search_sort=0&spq=0	요즘 몸이 이상합니다.	제목 그대로 요즘 몸이 이상합니다.점이 최근 1달 내에 5개 이상 생겼어요. 코로나 때문에 잘 나가지도 않아서 햇빛도 거의 받은 적 없어요. 그리고 나가더라도 긴팔 긴바지 입어서 노출이 전혀 없는 팔이랑 배에 점이 생겼네요.최근 5일 연속으로 잠에서 깼습니다. 한 달 전에는 3일 연속으로 거의 동일한 시간에 깼는데 깨고 나니 심장이 엄청 빨리 뛰는 것 같고 몸이 덜덜 떨리는 느낌이 들었습니다. 그 이후로 계속 잠에 쉽게 들지 못하고 자주 깹니다. 몇 년 전에도 잠에 쉽게 들지 못한 적은 꽤 있었는데 이정도로 잠이 안 오진 않았고 그 때는 잠에서 자주 깨지는 않았습니다. 30분 가량 누워있다가 잠이 안 온다 싶으면 그대로 잠을 자길 포기하고 한참 있다가 잠들곤 합니다.몸에 무슨 문제가 있는 걸까요?알려주세요 내공 100 겁니다	['안녕하세요. 대한의사협회·네이버 지식iN 상담의사 홍인표 입니다.점은 피부과 진료한번 받아보시는것이 좋구요심장이 빨리 뛰면 부정맥의 가능성이있어요  검사가 필요하고   만약에 검사에서 이상이없으면심리적인 이유가 있을것 같아요 공황장애 불안장애  같은거요빠른회복을 기원합니다\u200b']	작성일2020.03.21
764	https://kin.naver.com/qna/detail.nhn?d1id=6&dirId=60202&docId=351227600&qb=7L2U66Gc64KY&enc=utf8&section=kin&rank=765&search_sort=0&spq=0	생리 전 오한	지금 생리 직전이라서 기분도 오락가락하고 설사하고 피부 트러블에 가슴 압통까지 생리전 증후군이 엄청난데요 갑자기 오한도ㅠ오네요시국이 시국이라 코로나 아닐까 걱정돼요다른 호흡기 증상이나 발열은 없어요평소 비염 있고 손발 차고 추위 많이 타요생리 전 오한이 있을 수 있나요?	['안녕하세요. 하이닥-네이버 상담 한의사 박민수입니다. \u200b생리전 증후군으로 고생많으시네요. 생리전에도 오한이나 발열이 있을 수 있습니다. 최대한 외출을 자제하는 것이 좋고, 외부의 찬 바람을 피하는게 좋습니다. 생리전 증후군은 최근의 컨디션 상태를 반영하는 경우가 많습니다. 즉 현재 몸컨디션이 좋으면 생리전증후군이 아주 가볍거나 별로 없이 지나가지만, 현재 몸 상태가 좋지않다면 생리전증후군 또한 불편함과 불쾌감이 강도가 강하고 지속시간이 길어질 수 있습니다. 아무쪼록 몸관리 잘 하시길 권해드리며 해조류에 해당하는 쇠고기미역국이나 전복미역국 등의 자극적이지 않은 음식으로 몸조리하시길 바랍니다.']	작성일2020.03.24
765	https://kin.naver.com/qna/detail.nhn?d1id=6&dirId=602060203&docId=350408717&qb=7L2U66Gc64KY&enc=utf8&section=kin&rank=766&search_sort=0&spq=0	다한증 극복하는 법	안녕하세요 저는 중학생 2학년 남학생입니다제가 초등학교 4학년 정도부터 다한증이 있었던거 같은데6학년 때까지는 그렇게 신경안쓰고 살아왔지만 작년 중학교 1학년이 되고 나서부터 저희 학교가 자유학년제라 시험은 없지만 수행평가나 글쓰기 할때나 또는 학원에서 단어시험같은 걸 대부분 종이로 푸는데 특히나 제가 긴장하거나 여러사람들에게 서서 발표를 하면서 여러시선을 받을때 손,발,겨드랑이,인중,얼굴에서 특히나 땀이 많이 나는데 그럴 때마다 손에 있는 땀이 너무 신경쓰이고 또 겨드랑이에서 땀이 흘러내리고하면 “다른 사람이 보면 어쩌지”하는 생각이 머릿속을 가득 채우고 그때부터 멘탈 나가서 진짜 그 자리에서 사라지고 싶어져요..손이나 겨드랑이는 땀이나도 어떻게든 숨기면 되지만 특히 이마,인중 같은 경우에는 닦지 않고서야 숨길수가 없는데 인중에서 땀이 나면 사람들이 이상하게 볼 것같고.. 그리고 이마에서 땀이 흘러내리면 운동한 것도 아니고 좀 부끄럽고ㅜ 또 특히나 겨울에 손에서 땀나고 마르면 진짜 장갑을 끼지않은 이상 손에 동상걸린 것 처럼 손이너무 시리고 또 여름에는 더우니까 발에서 손보다 더 많이 땀이나는데 양말이 하얀색이나 검정색이 아닌 이상 회색이나 파란색 양말을 신고 신발을 벗으면 땀이 양말에 다 축축하게 젖어있고 또 냄새도 좀 나고 바닥을 걸을 때 발자국이 찍히고 할 때 내 자신이 너무 부끄럽고 싫어져요..ㅠ 지금 이 글 쓰면서도 손에서 나고 있네요.. 진짜 다한증은 사람을 포기하게 만드는거 같아요..이 다한증이라는게 완치는 안되지만 일시적으로 멈추게 한다는 치료법이 있다고는 해서 엄마께 말해봐서 일단 개학 전에 한의원을 다녀오기로 했는데 또 코로나 때문에 시국이 이래서...; 그리고 오이같은 야채먹어도 좋다고 해서 오이도 먹어보려고합니다.. 이야기가 길어졌으니 마무리 해야겠네요. 어쨌든 이 긴 글 읽어주셔서 감사하고 또 제가 아는것 말고도 다른게 있으면 추천해 주세요! 구체적으로 알려주세요.(악플,대충 답하지 말아주세요)	['많이 힘드시겠네요근본적인 원인치료는 힘들어요치료에 대한 반응도 사람마다 다르고바르는약을 사용해볼수 있구요약을 먹어보는 방법도 있구요보톡스 같은것을 주기적으로 맞을 수도 있구요신경에 주사를 맞거나 차단술을 새행해볼수있어요부모님과 상의하시는게 어떨까요?']	작성일2020.03.20
766	https://kin.naver.com/qna/detail.nhn?d1id=6&dirId=6080401&docId=350417902&qb=7L2U66Gc64KY&enc=utf8&section=kin&rank=767&search_sort=0&spq=0	무급휴가 관련 문의	안녕하세요 코로나여파로 무급휴가가 4월부터 시행된다는데문의합니다1) 해당 동의서에는 무급휴가라는 언급이 없습니다.임금 삭감에만 동의한다고 적혀있는데나중에 그럼 퇴직금과 실여급여 산정시 무급휴가기간은제외된다했는데 이럴 경우는 무급휴가가 아니라퇴사전 3개월 급여에 산정되어 퇴직금 및 실여급여에반영이 될까요?2) 동의서를 썻더라도 이런 상황이 지속되어자진퇴사시 실여급여를 받을 수 있을까요?3) 말이 동의서지 당일내로 무조건 적으라고 통보를 했습니다.협박이나 다름없는데 신고 가능할까요?	['안녕하세요. 한국공인노무사회-네이버 지식iN 상담 공인노무사 이종호 입니다.1. 퇴직금과 실업급여에는 문제가 발생하지않습니다2. 무급휴직관련 문제가 있으면 언제든 사업장관할 고용노동지청에 문의하시면     도움을 받을 수 있습니다.']	작성일2020.03.20
767	https://kin.naver.com/qna/detail.nhn?d1id=6&dirId=60201&docId=351012836&qb=7L2U66Gc64KY&enc=utf8&section=kin&rank=768&search_sort=0&spq=0	컨디션이 너무 안좋아요	현재 고3 남학생입니다키는 175고 몸무게는 75로 좀 근육있고 다부진 몸이에요근데 문제가 제가 너무 피곤해요 밤열시에 자서 여덞시에 일어나도 개운하지가 않아요그래서 너무 심해서 정신과가서 잠오는 약 먹었는데 다 안맞고 더 늦게일어나게 되서 걍 약은 안먹고 있어요. 그리고 평소 공부할때 자주 더워요 보통 36.1도라고 하면 공부하다 열나는 것 같아서 학원에 있는 체온계로 재면 37도가 나와요.요즘 코로나 때문에 학교도 안가서 그런가 슬슬 처지기도 하고 항상 피곤하고 기운없는건 똑같고비오는 날이거나 올락말락 그러면 더 그래요밥은 많이 먹는 편인데 항상 먹고나면 더부릅하고 많이 먹고 다음날 똥을 안싸면 디질것 같아요 기운이 쭉빠지고 서있질 못하겠어요. 결국 똥나오면 좀 개운하긴 한데 그래도 기운 없는건 똑같아요.운동부족인건가요? 아님 비타민 D 부족? 참고로 종합비타민은 꾸준히 먹고 있어요. 진짜 만성피로만 없으면 공부 더 열심히 할텐데...ㅠㅠ충고좀 해주세요 의사선생님들..ㅠㅠ	['운동좀 해보세요비타민디는 검사해보시고스트레스가 많으신가봅니다']	작성일2020.03.26
