	qna_urls	titles	questions	answers	dates
512	https://kin.naver.com/qna/detail.nhn?d1id=7&dirId=70111&docId=350499815&qb=7L2U66Gc64KY&enc=utf8&section=kin&rank=513&search_sort=0&spq=0	해고예고수당을 받을 수 있는지 궁금합니다.	안녕하세요~ 요즘 시국이 코로나19로 인해 다들 피해가 이만저만 아니실텐데 답변 미리 달아주셔서 감사인사드립니다. 제가 2019년 3월18일 파견업체 소속으로 1+1년 계약을 업체와 하였습니다. 원청은 1금융권에 있는 A라는 은행본사구요. 그러던중 2020년 3월17일이 근무한지 딱 1년째 되는 날인데 오전에 파견업체에서 새로운 1년에 대한 근로계약서를 보내주었길래 e-문서로 작성하고 송부하였고 당연히 아무일 없이 재계약 되는걸로 알고 있었습니다. 그런데 갑자기 퇴근 (보통 오후 6시)10분전쯤 되서 원청에서 코로나19로 인한 경기침체로 인해 회사 인건비 절감을 위해서 계약을 취소한다고 통보받았습니다. 파견업체쪽에서도 원청에서 갑자기 통보를 받고 저한테 말해주어서 결국 그날로 퇴사를 하게 되었습니다.이럴 때 제가 궁금한것은 아무리 계약만료라도 최소한 한달전에 미리 통보를 하고 시간을 줘야 하는걸로 알고있습니다. 그리고 기대갱신권(?)도 갖게 되었구요. 3월17일 오전까지만해도 바뀐 근로계약서를 썼는데말이죠. 이게 부당해고수당을 청구 할 수 있는 요건이 되는지 궁금합니다. 답변 부탁드리겠습니다.	['안녕하세요. 로시컴-네이버 지식iN 상담 공인노무사 전지나 입니다.\u200b갑작스러운 계약취소통보로 당황스러우셨을 것 같습니다. \u200b우선 1년근로계약을  체결하고 갱신하였는데 갑작스러운 계약만료취소를 통보받으셨다는 것으로 해석됩니다. 사업주가 일방적인 의사표시로 근로계약해지통보를 하는 것은 해고에 해당할 수 있습니다. 따라서 30일전에 해고예고를 하거나 해고예고수당을 지급해야합니다. \u200b질문자께서는 근로계약을 체결한 후에 갑작스럽게 해지통보를 받았다는 것은 해고통보로 볼 수 있습니다. 적법하게 근로계약이 체결된 후에 정당한 사유없이 근로계약을 일방적으로 해지하였다면 부당해고에 해당할 수 있습니다. 다만, 세부적인 해고의 정당성은 당사자간의 구체적인 근로계약, 취업규칙, 사실관계의 검토가 필요합니다. 따라서 관련서류를 지참하시어 전문가의 상담을 통해 부당해고를 다툴 수 있는 지 확인해보시는 것을 추천드립니다. \u200b위 내용은 질문하신 사항을 바탕으로 작성되었으며, 사실관계가 다를 경우 답변도 달라질 수 있습니다 감사합니다. 위와 관련된 사건과 관련하여 전문적인 상담이 필요한 경우 네이버 엑스퍼트 전문가에게 도움을 받으실 수 있으니 참고하시기 바랍니다. \u200b']	작성일2020.03.25
513	https://kin.naver.com/qna/detail.nhn?d1id=7&dirId=70111&docId=350499814&qb=7L2U66Gc64KY&enc=utf8&section=kin&rank=514&search_sort=0&spq=0	진통제 두통 질문	매일 아침에 일어나면 장시간 동안 뒷머리가 무거워서 걱정인데(막 일상생활에 지장있을 정도로 무겁진않으나 무거워서 그런지 힘이 조금 없네요)(편두통처럼 머리가 아프다거나 그런건아닙니다) 제가 원래 자주나가고 도서관 다니고 그러다 코로나때매 집에 지금 한달넘게 있게됐는데 그때부터 그러더라고요진통제도 효과가 별로 없는데 스트레스나 불규칙 생활이 원인인건가요?(노트북, 핸드폰 많이보게되고 잘 나가질 않게되네요)간단한 답도 괜찮습니다!! 빠른답변바랍니다 ㅠ	['안녕하세요. 하이닥-네이버 지식iN 상담의 박종원 입니다.큰 범주에서는 긴장성 두통이라고 합니다.긴장성두통이란 뒷목 근육의 경직에 의하여 근육 밑을 주행하는 후두신경이 압박되어두통이 발생하고이 경우 뒷목의 근육을 풀어주는 치료를 하게 됩니다.엑스레이를 찍어보면경추직선화(일자목) 또는 경추 배열의 부정렬소견이 관찰됩니다.신경과에 방문해서 간단한 물리치료와 신경치료를 받으시면 빠르게 호전됩니다.']	작성일2020.03.20
514	https://kin.naver.com/qna/detail.nhn?d1id=6&dirId=60206&docId=350823056&qb=7L2U66Gc64KY&enc=utf8&section=kin&rank=515&search_sort=0&spq=0	탁 관전 통증	한 일주일전부터 왼쪽 턱에 ㄴ자처럼 되어 있는 세로 부분(?)이 계속 아프네요 처음엔 너무 아파서 입을 아예 크게 벌리지 못했는데 지금은 통증이 좀 가라앉긴 했어요 그래도 입을 크게 벌리면 계속 근육이 땡기는 듯한 통증이 있네요18살 여고생이고 딱히 딱딱한 것도 안먹었는데 왜 계속 통증이 안 사라지는지;; 사랑니도 뽑은 적 없구요 오른쪽 턱은 좀 오래전부터 입을 버릴 때 딱딱거리긴 해요 비대칭이 심해져서 이러는 걸까요?? 코로나때문에 병원을 가기도 뭐하고..혹시 병원을 가야한다면 어느 병원으로 가야하죠?	['Loading... player_likesound_mutesound_mutesound_volume2sound_volume3 [x]Player Size:0 x 0Current Resolution:0PMax Abr Resolution:0PProtocol:pdCurrent Bandwidth:Average Bandwidth:Buffer Health:Frame Drop Rate:0/0 도움말라이센스Video Statistic Version 4.17.48 (PD)Build Date (2020/2/12)NAVER Corp.     동영상 인코딩 중입니다.5분 이상 소요될 수 있으며, 영상의 길이에 따라 소요 시간은 달라집니다. topleft rightbottom마우스를 드래그 하세요360° Video도움말 MULTI TRACK멀티트랙의 트랙별 영상은 우측 관련영상에서 볼 수 있습니다.선거광고 안내       음소거00:00 | 00:00 화질 선택 옵션 화질  전체화면   광고정보 더보기초 후 SKIP초 후 재생SKIP광고 후 계속됩니다.SNS 공유소스 코드Band Twitter Facebook Blog CafeURL 주소복사HTML 소스544 x 306740 x 416936 x 5261280 x 720복사Flash 미지원으로 Object 코드 퍼가기 기능은 더 이상 지원되지않습니다.도움말 플레이어 URL 복사 레이어 닫기접기/펴기````         \u200b\u200bhttps://www.youtube.com/channel/UCs-hwNc_lG5M57FREGUQbGg?view_as=subscriber              일차진료소 마취통증의학에서 다루는 질병들과 마취 지식을 알려드리는 채널입니다. 시간이 날 때 틈틈히 혼자 제작하는 거라서 업로드가 다소 느릴 수 있어 양해바랍니다. 감사합니다 www.youtube.com            \u200b']	작성일2020.03.22
515	https://kin.naver.com/qna/detail.nhn?d1id=7&dirId=70110&docId=350947836&qb=7L2U66Gc64KY&enc=utf8&section=kin&rank=516&search_sort=0&spq=0	쇄골 주변 갈색 반점	쇄골 주변에 옅은 갈색 반점이? 생겼어요 원래는 없었는데...오늘 씻다 보니까 옅은 색에 엄지 마디만한? 점 처럼은 안 생긴 그런 것들이 3군데에 있더라구요 쇄골 근처에만요 이게 혹시 뭔지 알 수 있을까요 피부과를 가야 하나요 매일매일 씻는데도 이런 게 생길 수 있나요 자외선 탓하기에는...코로나 때문에 최근 나간 기억도 없어요..	['안녕하세요. 피부과전문의 문익준 입니다. \u200b반점이 어떻게 보이는지 알 수 있어야 조금이라도 답을 드릴 수 있을 것 같습니다.가까운 피부과 전문의 선생님께 진료를 받아보세요.\u200b아래 링크에서 가까운 피부과 전문의 선생님을 검색해보세요.http://www.akd.or.kr/test/test.html           대한피부과의사회 당신은 피부과 전문의 에게 치료받고 계신가요? 우리동네 피부과 전문의가 궁금하다면, 지역명 병원명 전문의명 검색  www.akd.or.kr            \u200b']	작성일2020.03.25
516	https://kin.naver.com/qna/detail.nhn?d1id=6&dirId=60802&docId=350410112&qb=7L2U66Gc64KY&enc=utf8&section=kin&rank=517&search_sort=0&spq=0	자영업자개인회생 중이데, 카드가맹정 자격 여부	안녕하세요. 저는 자영업자입니다.  현재 아시다시피 코로나19로 손님이 뚝 끊겨서 장사 운영이 잘 안되어 자영업자개인회생신청을 할려고 생각중인데요.  자영업자개인회생을 하게되면 현실적으로 카드가맹점의 자격이 없어지는지 궁금합니다.  제가 식당을 하는데 카드 가맹점이 없어지면 장사하는데 어려움이 더 커질 것 같아서요ㅠㅠ  혹시 방법이 없을까요? 그리고 개인회생 중에 가게를 다른사람한테 매도 하면 어떻게 되나요? 꼭 답변 부탁드립니다.	[]	작성일2020.03.26
517	https://kin.naver.com/qna/detail.nhn?d1id=7&dirId=70104&docId=351241889&qb=7L2U66Gc64KY&enc=utf8&section=kin&rank=518&search_sort=0&spq=0	교통사고 보험금 합의	작년 12월 말에 보행자 신호 파란불에서 달려 오는 차량에 치여 발목 염좌로 2주 진단을 받았는데 삼 주 가량 치료를 받다 바쁜 업무와 코로나 사태로 병원을 꾸준히 다니지 못 하였습니다. 2달 하고 9일 정도 지난 지금 다시 통원치료를 받는다면 합의에 불리할까요? 현 상황은 제가 보험사가 제시한 금액이 타당하지 못하다고 생각하여 합의를 미루고 있고 이에 보험사 측에서는 조정신청을 한다고 합니다  관련태그: 보험 관련키워드: 보험, 합의, 코로나	['# 로톡 | 박수진 변호사 [변호사 프로필보기] # 사무실 문의 전화: 050-7725-2567  계속 병원에 다니시는 것은 상관없습니다. 그 동안 못 다닌 것인데 너무 안 좋아져서 다닌다면 문제 될 것이 없을 것으로 사료됩니다. 완치된 것이 아닌한 치료받는 것은 가능한 일이라 사료됩니다.  # 답변 변호사와의 상담을 원하신다면, 아래의 사무실 연락처로 전화문의 하시거나, [변호사 프로필보기]를 눌러보세요. - 박수진 변호사 사무실 문의전화: 050-7725-2567 - [변호사 프로필보기] < 클릭  - 변호사가 필요할 땐, 로톡 https://www.lawtalk.co.kr']	작성일2020.03.25
518	https://kin.naver.com/qna/detail.nhn?d1id=6&dirId=60802&docId=350610329&qb=7L2U66Gc64KY&enc=utf8&section=kin&rank=519&search_sort=0&spq=0	임대차계약해지	안녕하세요. 저는 임차인이고 최근 코로나 여파로 학원 운영이 어려워 임대인에게 계약해지를 요구했습니다. 그러나 해지에 합의해주면(중도해지시 위약금이 보증금의 40%나 됨) 공실이 생기며, 5년 임차확정을 조건으로 상가매입을 하였다며 계약해지에 합의해주지 않습니다.  이 같은 상황에서 임차인이 계약을 해지할 방안은 없는지요... 시간이 걸리더라도 다음 임차인을구해놓으라면서 현재보다 임대료를 5%를 올려서 부동산에 내놓으라고 했습니다. 경기가 너무 안좋아서 들어올 사람도 없고 하루라도 빨리 위약금 물더라도 해지를하고 싶습니다. 도저히 방법이없을까요...?	['안녕하세요. 서울지방변호사회-네이버 지식iN 상담 변호사 조민지 입니다.\u200b임대차기간이 정해져있는 경우, 임차인의 개인적인 사정만으로 계약을 중도해지하는 것은 어렵습니다.\u200b임대인의 동의에 의하여 합의해지는 가능하나, 임대인이 이를 거절한다면 일방적인 계약종료를 주장하기는 어려울 것으로 보입니다.\u200b본인이 계약한 임대차기간을 확인하여 보시고, 임대목적물의 하자로 인하여 임대목적물을 사용, 수익하는데 문제가 있는지 여부를 확인하여 보시기 바랍니다. \u200b임대인과 해지에 대한 합의가 있다고 하더라도 그 조건에 대하여 명확히 하여두지 않으면 추후 분쟁이 발생할 수 있으므로 조건에 대한 명확한 정리 및 관련 서류를 작성하여 두는 것이 좋습니다. \u200b이상 조민지 변호사가 답변드렸습니다.']	작성일2020.03.21
519	https://kin.naver.com/qna/detail.nhn?d1id=7&dirId=70112&docId=350309888&qb=7L2U66Gc64KY&enc=utf8&section=kin&rank=520&search_sort=0&spq=0	헬스장 이관 환불 어떻게 받나요?	저번 주에 헬스장 한 달 끊었는데 그저께에 갑자기 문자로 상가가 매매되어 다른 헬스장으로 이관되니 내일까지 개인 용품을 빼달라고 왔더라고요 그래서 찾아가니 안 계셔서 문자로 환불해달라고 남겼더니 전화가 와서 환불 안 되고 이관된 헬스장 이용하라고 하고 전화를 끊으셨어요 전 가까워서 그 헬스장을 이용한 건데 환불받으려면 어떻게 해야하죠ㅠㅠ? 게다가 코로나 때문에 이관된 헬스장은 문을 닫았더라고요 도대체 어쩌죠.... 근데 등록할 때 계약서? 같은 거 쓴 적 없습니다	['안녕하세요. 로톡-네이버 지식iN 상담변호사 주명호 입니다.\u200b먼저 안타까운 상황에 처하신 것에 대해 위로의 말씀을 전하며 질문에 답변을 드리겠습니다.\u200b민법상 채무자의 귀책사유에 의한 이행불능의 경우에는 채권자는 계약을 해제(환불)하고 손해가 있으면 손해배상 청구도 가능합니다. 헬스장 이용계약의 특성상 주소와 가까운 시설을 이용하는 것이 일반적이므로 채무자 측의 사정으로 이관된 헬스장을 이용하라는 것은 이행불능으로 평가될 수 있어 보입니다. 따라서 등록할 때 계약서를 쓰지 않았다고 하더라도 민법에 의하여 계약을 해제할 수 있을 것으로 보입니다.\u200b설사 이관된 헬스장을 이용하라는 것이 불완전 이행으로 평가되더라도 불완전 이행의 경우에도 그 모습이 이행불능으로 평가된다면 이행불능을 원인으로 한 계약 해제를 유추할 수 있으므로 결론은 달라지지 않을 것으로 보입니다.\u200b위 답변은 질문자님의 질문을 전제로 답변을 드린 것인바, 온라인 상으로 답변하기에 여러 제약들이 있을 수 있으니 추가 궁금한 사항이 있으시면 프로필상의 전화로 연락을 주시면 자세하게 상담을 드리겠습니다.\u200b감사합니다.']	작성일2020.03.27
520	https://kin.naver.com/qna/detail.nhn?d1id=6&dirId=60804&docId=350431873&qb=7L2U66Gc64KY&enc=utf8&section=kin&rank=521&search_sort=0&spq=0	크라운관련	2월중순쯤에 신경치료 끝내고 크라운 덮기전에 일주일정도 지르코니아 크라운 제작된걸 임시로붙여놓고 괜찮으면 완전히 붙인다고하셨는데 사용후에도계속통증와서 치과방문해보니 몇주더써보고 아프면 다시신경치료들어가자고 하셨는데ㅜㅜ지금 코로나가 심해져서 치과가기가 꺼려져서요 ㅜㅠ혹시아직통증이그대로있는데 이렇게 임시로 놔두면 혹시 더 심해질지 아님ㅠ코로나조금 잠잠해지면 가야될지ㅜㅠ답변부탁드립니다	['안녕하세요. 대한치과의사협회-네이버 지식인 상담치과의사 최진호 입니다.임시치아 부착 중에는 통증이 있을 수 있지만, 완성된 크라운을 씌울 때는 통증이 없어야 합니다. 통증이 그대로라면 크라운 씌우기 전 치과에서 다시금 확인해 보실 필요가 있으며, 만약 치아뿌리에서 발현되는 통증이라면 염증이 통증의 이유가 될 수 있으며, 갈수록 통증이 심해질 수도 있으니, 상황이 좀 애매하긴 하지만 치과에 연락을 하셔서 검진을 다시 받아보시는 것을 권합니다.']	작성일2020.03.27
521	https://kin.naver.com/qna/detail.nhn?d1id=6&dirId=60802&docId=350441671&qb=7L2U66Gc64KY&enc=utf8&section=kin&rank=522&search_sort=0&spq=0	여유증 질문	제가 키 184에 몸무게 80정도됩니다 예전엔 95정도 나갔어서 살빼면 가슴살도 빠지겠거니해서 살을 뺐는데 이상하게 가슴살만 안빠져요 혹시 여유증인가요? 부모님한테 말씀드려보니 일단 코로나가 안정되면 성형외과 를 가보자하셨는데 궁금해서 올려봅니다. 그리고 제가 어렸을때 심장부분이 움푹페여서 겨드랑이 밑쪽에 수술자국이 있는데 혹시 연관이 있을까요? 이제 겨울도 끝나서 얇은옷을 입을텐데 가슴살때문에 펑퍼짐한옷만 입을거같아서 미치겠습니다 ㅠ 사진이 혐오스러운점 주의바랍니다	['안녕하세요. 하이닥-네이버 지식iN 상담의 김형진 입니다.여유증은 남성유방에서 유선 조직의 증식이 일어나 여성처럼유방이 발달하는 상태를 말합니다.\u200b원인은 다양하나 호르몬의 변화, 약물에 의한 경우, 원인을 알수없는 경우 등이 있을 수 있습니다. 정확한 진단을 위해서 먼저병원에 내원을 하셔서 전문의와 상담을 통해서 확인을 해보시길바랍니다. 감사합니다.']	작성일2020.03.18
522	https://kin.naver.com/qna/detail.nhn?d1id=7&dirId=70104&docId=350607009&qb=7L2U66Gc64KY&enc=utf8&section=kin&rank=523&search_sort=0&spq=0	일주일동안 열이 안떨어지네요.	저번주 목요일?부터 37.2정도에서 이번주 월요일엔 38도까지 올라갔습니다. 해열제먹어도 떨어지지않아서 바로 코로나19 검사까지 했지만 음성판정 나왔구요. 코로나19에 확진자접촉, 여행, 그외의 증상은 전혀 없습니다. 혹시 몰라서 했지만 음성판정나와 약먹고 있는데도 일주일이 넘게 37.7-38.5 사이네요..목이 아프거나 콧물.기침 전혀 없고 두통과 열만 있는상태입니다.. 내과 방문하면 될까요..? 친오빠가 저랑 비슷한 증상보이다 백혈병 진단받고 작년 세상을 떠났습니다.. 어디 병원을 가야하나요.. 요즘 코로나때문에 병원방문이 어려운데 음성판정 받은 문자보여드리면 검사받을수있나요..장난스런 답변 신고합니다.	['안녕하세요. 대한의사협회·네이버 지식iN 상담의사 이세라 입니다.\u200b인근 내과를 방문후 진료의뢰서를 발급받아 대학병원으로 가거나 선별진료소가 있는.대학병원으로 가는.것을 고려 하세요.']	작성일2020.03.20
523	https://kin.naver.com/qna/detail.nhn?d1id=7&dirId=70401&docId=351145151&qb=7L2U66Gc64KY&enc=utf8&section=kin&rank=524&search_sort=0&spq=0	고용지원금 수급중인 회사 직원의 퇴사	현재 저희 회사가 코로나로 인해 고용지원금을 지원받고 휴업중인데요제가 곧 퇴사를 하려고 합니다헌데 상사가 얘기하길 고용지원금 지급중인 상태에서 퇴사 할 경우 지급받은 급여를 반납해야 한다고 하던데 사실인가요?그게 사실이면 휴업이 끝나는 시점에서 퇴사 할 경우에는 문제가 없는건지 궁금합니다고용지원금이 퇴사까지 관여된다는게 이상하네요	['안녕하세요. 한국공인노무사회-네이버 지식iN 상담 공인노무사 이종호 입니다.1. 고용지원금지원 받는기간동안 사업주귀책사유로 근로자 해고시는 고용유지지원금이 지원되지않으나근로자가 자발적퇴직시에는 별도로 문제는 발생하지 않습니다2. 단지 본인에대한 일부 고용유지지원금을 지급받지 못 할 수 있습니다3. 기타 자세한문의사항은 1350이나  사업장 관할 고용센터에 문의하심 도움 받으실 수 있습니다\u200b']	작성일2020.03.22
524	https://kin.naver.com/qna/detail.nhn?d1id=7&dirId=70115&docId=351146024&qb=7L2U66Gc64KY&enc=utf8&section=kin&rank=525&search_sort=0&spq=0	퇴직금지급처리	코로나로 학원 운영이 어려워 갑자기 강사분을 2월29일일자로 퇴사처리하게 되었습니다.그래서 해고예고수당과 퇴지금정산을 3월31일에 지급하게 되는데 세무서에서 명세서 보내주신건 2월28일 지급일로 해서 보내주셨는데 실제 지급일은 3월31일에 지급하는 부분이라 일자가 달라도 차후에 문제는 없을까요?또 지급처리하면서 은행으로 거래를 하게 되지만 따로 지급처리 다 받았다는 직원 싸인을 따로 받아야 하는건가요?제가 직원을 채용하고 사업을 처음하는거라 여러번 사람에게 안좋은 일을 겪다 보니까 나중에 꼬투리 잡아서 문제가 발생하게 되어서 어떻게 처리해야 나중에 문제가 생기지 않는건지 알려주세요~~	['안녕하세요. 로시컴-네이버 지식iN 상담 공인노무사 최창국 입니다.\u200b1. 지급일은 사용자와 근로자가 합의한 일자로 해두는 것이 좋습니다. 3.31 지급일로 합의한 경우 그때로 정정하는 것이 좋기는 합니다. 그러나 꼭 고치지 않더라도 법적으로 문제가 될 여지가 많지는 않습니다.\u200b2. 퇴직금과 해고예고수당을 지급하는 경우에는 분리해서 해고예고수당 + 퇴직금으로 기재하여 따로 이체하시면 됩니다.\u200b3. 분쟁을 확실하게 방지하려면 해고예고수당, 퇴직금을 지급 받았음을 확인하는 합의서 또는 영수증을 받아 두는 것이 좋습니다.']	작성일2020.03.24
525	https://kin.naver.com/qna/detail.nhn?d1id=6&dirId=60224&docId=350131721&qb=7L2U66Gc64KY&enc=utf8&section=kin&rank=526&search_sort=0&spq=0	한쪽 얼굴 눈 머리 잇몸가 아파요	"20살 청년입니다오늘 아침 일어나니깐 갑자기 왼쪽얼굴에 두통, 눈, 잇몸이 쿡쿡 쑤시는 것처럼 아파오기 시작했습니다. 근육이 아프다고 해야하나?일어나서 일상생활을 하다보니깐 아픈건 많이 없어지고 두통만 아주조금 ""아! 머리 쑤신다"" 이정도였습니다.그런데 일을 마치고 집에 들어와서 침대에 왼쪽으로 누워있으면서 핸드폰을 보고있었는데 갑자기 고통이심해지는겁니다. 아침보다 훨씬 아팠습니다.벌떡일어나 1분정도 참고있더니 거짓말같이 고통은 없어졌습니다. 아픔도 왼쪽얼굴만 아팠구요.그래도 머리가 쑤시는건 사라지지않네요.하필 코로나가 판을 치고있을떄 아프니깐 의심스럽고 두렵네요. 안면근육마비도 아니고..난생 처음 겪어본 일이라 심한건 아닌지 궁금합니다."	['안녕하세요. 하이닥-네이버 지식iN 상담의 박종원 입니다.뒷목과 상부 흉추가 오랫동안 경직되면나타나는 현상으로 증상이 기복이 있을 수 있습니다치료는 뒷목의 두판상근과 1,2,3,4번 흉추의 심부근육을 확인하여근긴장이 확인되면머리와 안면, 눈, 귀의 미세혈류장애 호전을 위한 근육이완 치료를 하게 됩니다.보통은 주사치료를 포함해서 물리치료,도수치료 등을 흔하게 합니다.가까운 곳의 신경통증관련 병원들을 2곳 이상 방문해 보시는 것이 도움이 되고직접 치료를 받아보시면 좋겠습니다.']	작성일2020.03.27
526	https://kin.naver.com/qna/detail.nhn?d1id=7&dirId=71102&docId=350440916&qb=7L2U66Gc64KY&enc=utf8&section=kin&rank=527&search_sort=0&spq=0	수출신고필증 정정 기준	수출신고필증상에 중요 정보( 품번, 수량, 제조사명) 이런 오류가 아니라,인보이스 번호가 한글자 빠지거나, 품번이 한글자 빠졌거나 이런오류가 4건이나 있더라구요이러한 소소한 오류도 전부 수정을 해야할까요 (지금까지는 다 수정 해왔는데)회계처리나, 기타 문제가 되는지 궁금합니다.(특히나 코로나 사태때문에 운송사에 연락이 잘 안되서 필증 정정도 바로바로 처리가 안되고 있어서천안세관에라도 문의하고 싶은데 거기도 연락이 잘 안된다는 블로그글을 봤어요)도움 부탁드립니다.	['안녕하십니까 한국관세사회-네이버 지식iN 관세사 임형철 입니다.\u200b소소한 부분이라 굳이 정정할 필요는 없습니다(다만 추후 관세환급시 모델규격 상이로 문제가 될 수는 있으나 단순 오류로 소명하시면 됩니다)\u200b위와 같은 오류는 관세사무소에서 직원이 신고서 입력시 발생하는 human error이므로 관세사무소에 주의를 요청하시면 됩니다\u200b수출신고는 운송사가 아닌 운송사와 연계된 관세사무소에서 진행하는 것 입니다\u200b가능하면 수출자가 직접 관세사무소에 연락하셔서 업무 의뢰 및 커뮤니케이션을 하시는 것이 좋습니다\u200b참고하시기 바랍니다']	작성일2020.03.18
